,Raw,Root,Translation,Sentence
349,resources,resourc,kaynak, Connecting computers together to form a network can provide the ‘connectivity’ required to enable computers and software to communicate and fo share resources
350,not,not,olumsuzluk,  Unlike most machines computers do not have a fixed purpose
351,painting,paint,boyamak, video files attached to simple email text messages distance learning and videoconferencing a form of communication over a network that uses video cameras so that the people taking part can see and hear each other electronic classrooms or boardrooms browsing the Web moving from webpage to webpage using a Web browser program selling using a website painting scanning pictures downloading music and creating CDROMs compact disk read only memory commonly referred to as CDs
352,Transfer,transfer,Aktar, An Internet service called FTP File Transfer Protocol is used for transferring data or program files between the powerful server computers that provide the network services and the client computers that use these services e
353,camera,camera,kamera, A digital camera allows photographs to be input to a computer for editing
354,threedimensional,threedimension,üç boy, Computer uses mentioned in this unit include producing greetings cards learning using threedimensional graphics programs called ‘Splat the Cat’ and ‘Pets 3’ using the Microsoft Word wordprocessing program including features such as clipart readydrawn graphic images that can be inserted into documents communicating on the Internet using email and chat programs including the use of email attachments other types of files e
355,‘Splat,splat,yaymak, Computer uses mentioned in this unit include producing greetings cards learning using threedimensional graphics programs called ‘Splat the Cat’ and ‘Pets 3’ using the Microsoft Word wordprocessing program including features such as clipart readydrawn graphic images that can be inserted into documents communicating on the Internet using email and chat programs including the use of email attachments other types of files e
356,button,button,buton, This is done by pressing a button on the mouse i
357,multipurpose,multipurpos,çok amaçlı, They are multipurpose tools
358,delay,delay,gecikme, without any delay while the users are logged on connected to a network system account normally using a password to the system
359,attachments,attach,eklemek, Computer uses mentioned in this unit include producing greetings cards learning using threedimensional graphics programs called ‘Splat the Cat’ and ‘Pets 3’ using the Microsoft Word wordprocessing program including features such as clipart readydrawn graphic images that can be inserted into documents communicating on the Internet using email and chat programs including the use of email attachments other types of files e
360,text,text,Metin, A multimedia computer can process different forms of data including text graphics audio sound animation and video
361,the,the,., The equipment is known as  the hardware and the programs and data  are the software
362,hear,hear,duymak, video files attached to simple email text messages distance learning and videoconferencing a form of communication over a network that uses video cameras so that the people taking part can see and hear each other electronic classrooms or boardrooms browsing the Web moving from webpage to webpage using a Web browser program selling using a website painting scanning pictures downloading music and creating CDROMs compact disk read only memory commonly referred to as CDs
363,without,without,olmadan, without any delay while the users are logged on connected to a network system account normally using a password to the system
364,writing,write,yazmak, CDROMs are storage devices that use laser light for reading and writing data
365,touch,touch,dokunmak,  Services such as these allow people to telecommute use their computers to stay in touch with the office while they are working at home
366,paper,paper,kağıt, One of the most common peripherals is a printer used for printing the computer output the processed data or signals that come out of a computer system   on paper
367,health,health,sağlık, smart cards which are able to store information such as health records drivers’ licences bank balances etc
368,connection,connect,bağlamak, The connection of networks throughout the world is known as the Internet note that a capital  is used or more simply the Net
369,relevant,relev,yeniden yaşamak, Websites such as Dogpile and AskJeeves give the user        access to special programs called search engines that are designed to allow the user to find relevant webpages on the Web
370,treatment,treatment,tedavi, Medical expert systems for example can help doctors diagnose an illness and decide on the best treatment
371,other,other,başka, Antivirus programs are used to detect and remove viruses harmful programs that can reproduce themselves and attach themselves to other programs
372,transferring,transfer,Aktar, An Internet service called FTP File Transfer Protocol is used for transferring data or program files between the powerful server computers that provide the network services and the client computers that use these services e
373,user’s,user,kullanıcı, The most common storage device is a hard disk a set of aluminium disks coated in a magnetic material and enclosed in a vacuumsealed case used for storing the operating system and applications programs as well as the user’s data
374,carried,carri,vagonlar, Those designed for use by one person at a time are known as personal computers PCs although the term PC is usually only applied to personal computers that are compatible with the standards laid down by the company known as IBM  computers include desktop computers for use on an office desk and handheld computers that can be carried around by the user
375,education,educ,eğitim, This enables computer systems to be used for a combination of education and entertainment sometimes referred to as edutainment
376,copying,copi,kopya, Note that copying data from a larger server system to a client is referred to as downloading and copying from the client to the server is known as uploading
377,provides,provid,sağlayan, A special set of programs called an operating system provides an interface for the user and allows applications programs to communicate with the hardware
378,parts,part,Bölüm,        It is also possible to build all the main parts of a computer into one electronic integrated circuit packaged as a single electronic chip the common name for a microchip an electronic integrated circuit in a small package i
379,IRC,irc,IRC, Various communication services are available on the Internet including email electronic mail for sending and receiving text messages and IRC Internet Relay Chat which allows users to communicate using text messages in realtime i
380,expert,expert,uzman, Advanced systems known as expert systems enable computers to ‘think’ like experts
381,built,built,inşa edilmiş, This enables computers to be built into other devices including household devices such as washing machines and fridges and to be incorporated into plastic cards i
382,package,packag,paketi,        It is also possible to build all the main parts of a computer into one electronic integrated circuit packaged as a single electronic chip the common name for a microchip an electronic integrated circuit in a small package i
383,newest,newest,en yeni,  One of the newest and most popular services available on the Internet is the Worid Wide Web WWW which is often simply referred to as the Web note the use of the capital W
384,decide,decid,karar ver, Medical expert systems for example can help doctors diagnose an illness and decide on the best treatment
385,Networks,network,ağ, Networks connected together form an internet
386,browser,browser,tarayıcı, video files attached to simple email text messages distance learning and videoconferencing a form of communication over a network that uses video cameras so that the people taking part can see and hear each other electronic classrooms or boardrooms browsing the Web moving from webpage to webpage using a Web browser program selling using a website painting scanning pictures downloading music and creating CDROMs compact disk read only memory commonly referred to as CDs
387,Note,note,Not, Note that copying data from a larger server system to a client is referred to as downloading and copying from the client to the server is known as uploading
388,around,around,etrafında, Those designed for use by one person at a time are known as personal computers PCs although the term PC is usually only applied to personal computers that are compatible with the standards laid down by the company known as IBM  computers include desktop computers for use on an office desk and handheld computers that can be carried around by the user
389,expansion,expans,genişler, Electronics can be added to desktop computers by plugging in expansion cards electronic circuit boards that can be plugged into special sockets called expansion slots
390,storage,storag,depolamak, CDROMs are storage devices that use laser light for reading and writing data
391,Various,various,çeşitli, Various communication services are available on the Internet including email electronic mail for sending and receiving text messages and IRC Internet Relay Chat which allows users to communicate using text messages in realtime i
392,printing,print,Yazdır, One of the most common peripherals is a printer used for printing the computer output the processed data or signals that come out of a computer system   on paper
393,coated,coat,ceket, The most common storage device is a hard disk a set of aluminium disks coated in a magnetic material and enclosed in a vacuumsealed case used for storing the operating system and applications programs as well as the user’s data
394,ina,ina,ne zaman, Common applications programs include wordprocessors for creating and editing texts spreadsheets for calculating mathematical formulae and databases for storing data ina way that allows the data to be sorted and searched
395,The,the,., The equipment is known as  the hardware and the programs and data  are the software
396,readydrawn,readydrawn,rafine etme, Computer uses mentioned in this unit include producing greetings cards learning using threedimensional graphics programs called ‘Splat the Cat’ and ‘Pets 3’ using the Microsoft Word wordprocessing program including features such as clipart readydrawn graphic images that can be inserted into documents communicating on the Internet using email and chat programs including the use of email attachments other types of files e
397,Dogpile,dogpil,Dogpil, Websites such as Dogpile and AskJeeves give the user        access to special programs called search engines that are designed to allow the user to find relevant webpages on the Web
398,being,be,olmak, As computer systems are developed they are becoming more common and are gradually being used for more and more purposes
399,with,with,ile birlikte, A special set of programs called an operating system provides an interface for the user and allows applications programs to communicate with the hardware
400,enable,enabl,elden çıkarmak, Advanced systems known as expert systems enable computers to ‘think’ like experts
401,designed,design,tasarım, Those designed for use by one person at a time are known as personal computers PCs although the term PC is usually only applied to personal computers that are compatible with the standards laid down by the company known as IBM  computers include desktop computers for use on an office desk and handheld computers that can be carried around by the user
402,hardware,hardwar,kabadayı, The equipment is known as  the hardware and the programs and data  are the software
403,only,onli,Onli, Those designed for use by one person at a time are known as personal computers PCs although the term PC is usually only applied to personal computers that are compatible with the standards laid down by the company known as IBM  computers include desktop computers for use on an office desk and handheld computers that can be carried around by the user
404,interactive,interact,etkileşime girmek, An Internet system designed to provide free interactive access to vast resources for people all over the world is sometimes referred to as an information superhighway
405,communicating,communic,İletişim, Computer uses mentioned in this unit include producing greetings cards learning using threedimensional graphics programs called ‘Splat the Cat’ and ‘Pets 3’ using the Microsoft Word wordprocessing program including features such as clipart readydrawn graphic images that can be inserted into documents communicating on the Internet using email and chat programs including the use of email attachments other types of files e
406,inserted,insert,sokmak, Computer uses mentioned in this unit include producing greetings cards learning using threedimensional graphics programs called ‘Splat the Cat’ and ‘Pets 3’ using the Microsoft Word wordprocessing program including features such as clipart readydrawn graphic images that can be inserted into documents communicating on the Internet using email and chat programs including the use of email attachments other types of files e
407,Internet,internet,internet, The connection of networks throughout the world is known as the Internet note that a capital  is used or more simply the Net
408,unit,unit,birim, Computer uses mentioned in this unit include producing greetings cards learning using threedimensional graphics programs called ‘Splat the Cat’ and ‘Pets 3’ using the Microsoft Word wordprocessing program including features such as clipart readydrawn graphic images that can be inserted into documents communicating on the Internet using email and chat programs including the use of email attachments other types of files e
409,cards,card,kart, Electronics can be added to desktop computers by plugging in expansion cards electronic circuit boards that can be plugged into special sockets called expansion slots
