,Raw,Root,Translation,Sentence
0,sound,sound,ses, A multimedia computer can process different forms of data including text graphics audio sound animation and video
1,plastic,plastic,plastik, This enables computers to be built into other devices including household devices such as washing machines and fridges and to be incorporated into plastic cards i
2,viruses,virus,virüs, Antivirus programs are used to detect and remove viruses harmful programs that can reproduce themselves and attach themselves to other programs
3,interface,interfac,arayüz, A special set of programs called an operating system provides an interface for the user and allows applications programs to communicate with the hardware
4,learning,learn,öğrenmek, Computer uses mentioned in this unit include producing greetings cards learning using threedimensional graphics programs called ‘Splat the Cat’ and ‘Pets 3’ using the Microsoft Word wordprocessing program including features such as clipart readydrawn graphic images that can be inserted into documents communicating on the Internet using email and chat programs including the use of email attachments other types of files e
5,items,item,öğe, Some operating systems have graphical user interfaces that allow the computer user to select items from menus lists of choices and to start programs using an input device called a mouse
6,calculating,calcul,Kalküta, Common applications programs include wordprocessors for creating and editing texts spreadsheets for calculating mathematical formulae and databases for storing data ina way that allows the data to be sorted and searched
7,available,avail,yaramak, Various communication services are available on the Internet including email electronic mail for sending and receiving text messages and IRC Internet Relay Chat which allows users to communicate using text messages in realtime i
8,plugged,plug,fiş, Electronics can be added to desktop computers by plugging in expansion cards electronic circuit boards that can be plugged into special sockets called expansion slots
9,graphics,graphic,grafik, A multimedia computer can process different forms of data including text graphics audio sound animation and video
10,output,output,çıktı, The main device for inputting the data is a typewriter style keyboard and the output is commonly displayed on a monitor screen that looks like a small television screen
11,they,they,onlar, As computer systems are developed they are becoming more common and are gradually being used for more and more purposes
12,light,light,ışık, CDROMs are storage devices that use laser light for reading and writing data
13,often,often,sıklıkla,  One of the newest and most popular services available on the Internet is the Worid Wide Web WWW which is often simply referred to as the Web note the use of the capital W
14,also,also,ayrıca,        It is also possible to build all the main parts of a computer into one electronic integrated circuit packaged as a single electronic chip the common name for a microchip an electronic integrated circuit in a small package i
15,videoconferencing,videoconferenc,video konferans, video files attached to simple email text messages distance learning and videoconferencing a form of communication over a network that uses video cameras so that the people taking part can see and hear each other electronic classrooms or boardrooms browsing the Web moving from webpage to webpage using a Web browser program selling using a website painting scanning pictures downloading music and creating CDROMs compact disk read only memory commonly referred to as CDs
16,looks,look,bakmak, The main device for inputting the data is a typewriter style keyboard and the output is commonly displayed on a monitor screen that looks like a small television screen
17,Some,some,bazı, Some operating systems have graphical user interfaces that allow the computer user to select items from menus lists of choices and to start programs using an input device called a mouse
18,case,case,dava, The most common storage device is a hard disk a set of aluminium disks coated in a magnetic material and enclosed in a vacuumsealed case used for storing the operating system and applications programs as well as the user’s data
19,devices,devic,bakire, This enables computers to be built into other devices including household devices such as washing machines and fridges and to be incorporated into plastic cards i
20,Net,net,ağ, The connection of networks throughout the world is known as the Internet note that a capital  is used or more simply the Net
21,larger,larger,daha büyük, Note that copying data from a larger server system to a client is referred to as downloading and copying from the client to the server is known as uploading
22,moving,move,hareket, video files attached to simple email text messages distance learning and videoconferencing a form of communication over a network that uses video cameras so that the people taking part can see and hear each other electronic classrooms or boardrooms browsing the Web moving from webpage to webpage using a Web browser program selling using a website painting scanning pictures downloading music and creating CDROMs compact disk read only memory commonly referred to as CDs
23,variety,varieti,Çeşitlilik, They can be used in a very wide variety of situations and are found in a wide range of systems including security systems cars and phones
24,‘computer,comput,hesap, the ‘computer on a chip’
25,single,singl,bekar,        It is also possible to build all the main parts of a computer into one electronic integrated circuit packaged as a single electronic chip the common name for a microchip an electronic integrated circuit in a small package i
26,throughout,throughout,boyunca, The connection of networks throughout the world is known as the Internet note that a capital  is used or more simply the Net
27,How,how,nasıl, How they are developed and for what purposes they are actually used in the future can be influenced by computer users
28,Advanced,advanc,ilerleme, Advanced systems known as expert systems enable computers to ‘think’ like experts
29,same,same,aynı,e they cannot use the same programs and data
30,boardrooms,boardroom,toplantı odası, video files attached to simple email text messages distance learning and videoconferencing a form of communication over a network that uses video cameras so that the people taking part can see and hear each other electronic classrooms or boardrooms browsing the Web moving from webpage to webpage using a Web browser program selling using a website painting scanning pictures downloading music and creating CDROMs compact disk read only memory commonly referred to as CDs
31,term,term,terim, Those designed for use by one person at a time are known as personal computers PCs although the term PC is usually only applied to personal computers that are compatible with the standards laid down by the company known as IBM  computers include desktop computers for use on an office desk and handheld computers that can be carried around by the user
32,desktop,desktop,masaüstü, Those designed for use by one person at a time are known as personal computers PCs although the term PC is usually only applied to personal computers that are compatible with the standards laid down by the company known as IBM  computers include desktop computers for use on an office desk and handheld computers that can be carried around by the user
33,name,name,isim,        It is also possible to build all the main parts of a computer into one electronic integrated circuit packaged as a single electronic chip the common name for a microchip an electronic integrated circuit in a small package i
34,sorted,sort,çeşit, Common applications programs include wordprocessors for creating and editing texts spreadsheets for calculating mathematical formulae and databases for storing data ina way that allows the data to be sorted and searched
35,each,each,her biri, video files attached to simple email text messages distance learning and videoconferencing a form of communication over a network that uses video cameras so that the people taking part can see and hear each other electronic classrooms or boardrooms browsing the Web moving from webpage to webpage using a Web browser program selling using a website painting scanning pictures downloading music and creating CDROMs compact disk read only memory commonly referred to as CDs
36,sending,send,göndermek, Various communication services are available on the Internet including email electronic mail for sending and receiving text messages and IRC Internet Relay Chat which allows users to communicate using text messages in realtime i
37,instructions,instruct,öğretmek,A computer is a device that processes data according to a set of instructions known  as a program
38,‘Pets,pet,Evcil Hayvan, Computer uses mentioned in this unit include producing greetings cards learning using threedimensional graphics programs called ‘Splat the Cat’ and ‘Pets 3’ using the Microsoft Word wordprocessing program including features such as clipart readydrawn graphic images that can be inserted into documents communicating on the Internet using email and chat programs including the use of email attachments other types of files e
39,Devices,devic,bakire, Devices that include a computer circuit are commonly referred to as smart devices
40,Electronics,electron,elektron, Electronics can be added to desktop computers by plugging in expansion cards electronic circuit boards that can be plugged into special sockets called expansion slots
41,give,give,vermek, Websites such as Dogpile and AskJeeves give the user        access to special programs called search engines that are designed to allow the user to find relevant webpages on the Web
42,mail,mail,posta, Various communication services are available on the Internet including email electronic mail for sending and receiving text messages and IRC Internet Relay Chat which allows users to communicate using text messages in realtime i
43,machines,machin,makine, This enables computers to be built into other devices including household devices such as washing machines and fridges and to be incorporated into plastic cards i
44,free,free,Bedava, An Internet system designed to provide free interactive access to vast resources for people all over the world is sometimes referred to as an information superhighway
45,superhighway,superhighway,korumalı, An Internet system designed to provide free interactive access to vast resources for people all over the world is sometimes referred to as an information superhighway
46,special,special,özel, A special set of programs called an operating system provides an interface for the user and allows applications programs to communicate with the hardware
47,hard,hard,sert, The most common storage device is a hard disk a set of aluminium disks coated in a magnetic material and enclosed in a vacuumsealed case used for storing the operating system and applications programs as well as the user’s data
48,Antivirus,antivirus,antivirüs, Antivirus programs are used to detect and remove viruses harmful programs that can reproduce themselves and attach themselves to other programs
49,animation,anim,anim, A multimedia computer can process different forms of data including text graphics audio sound animation and video
50,Unlike,unlik,un,  Unlike most machines computers do not have a fixed purpose
51,keyboard,keyboard,tuş takımı, The main device for inputting the data is a typewriter style keyboard and the output is commonly displayed on a monitor screen that looks like a small television screen
52,different,differ,farklılık, A multimedia computer can process different forms of data including text graphics audio sound animation and video
53,printer,printer,yazıcı, One of the most common peripherals is a printer used for printing the computer output the processed data or signals that come out of a computer system   on paper
54,interfaces,interfac,arayüz, Some operating systems have graphical user interfaces that allow the computer user to select items from menus lists of choices and to start programs using an input device called a mouse
55,company,compani,şirket, Those designed for use by one person at a time are known as personal computers PCs although the term PC is usually only applied to personal computers that are compatible with the standards laid down by the company known as IBM  computers include desktop computers for use on an office desk and handheld computers that can be carried around by the user
56,logged,log,kayıt, without any delay while the users are logged on connected to a network system account normally using a password to the system
57,sockets,socket,priz, Electronics can be added to desktop computers by plugging in expansion cards electronic circuit boards that can be plugged into special sockets called expansion slots
58,inputting,input,giriş, The main device for inputting the data is a typewriter style keyboard and the output is commonly displayed on a monitor screen that looks like a small television screen
59,packaged,packag,paketi,        It is also possible to build all the main parts of a computer into one electronic integrated circuit packaged as a single electronic chip the common name for a microchip an electronic integrated circuit in a small package i
60,externally,extern,hariç, A variety of devices known as peripherals can be added externally to a computer
61,producing,produc,üretim, Computer uses mentioned in this unit include producing greetings cards learning using threedimensional graphics programs called ‘Splat the Cat’ and ‘Pets 3’ using the Microsoft Word wordprocessing program including features such as clipart readydrawn graphic images that can be inserted into documents communicating on the Internet using email and chat programs including the use of email attachments other types of files e
62,Those,those,şunlar, Those designed for use by one person at a time are known as personal computers PCs although the term PC is usually only applied to personal computers that are compatible with the standards laid down by the company known as IBM  computers include desktop computers for use on an office desk and handheld computers that can be carried around by the user
63,forms,form,biçim, A multimedia computer can process different forms of data including text graphics audio sound animation and video
64,find,find,bulmak, Websites such as Dogpile and AskJeeves give the user        access to special programs called search engines that are designed to allow the user to find relevant webpages on the Web
65,phones,phone,telefon, They can be used in a very wide variety of situations and are found in a wide range of systems including security systems cars and phones
66,include,includ,Dahil etmek, Common applications programs include wordprocessors for creating and editing texts spreadsheets for calculating mathematical formulae and databases for storing data ina way that allows the data to be sorted and searched
67,normally,normal,normal, without any delay while the users are logged on connected to a network system account normally using a password to the system
68,bank,bank,banka, smart cards which are able to store information such as health records drivers’ licences bank balances etc
69,working,work,iş,  Services such as these allow people to telecommute use their computers to stay in touch with the office while they are working at home
70,Services,servic,Hizmet,  Services such as these allow people to telecommute use their computers to stay in touch with the office while they are working at home
71,allows,allow,izin vermek, A special set of programs called an operating system provides an interface for the user and allows applications programs to communicate with the hardware
72,vacuumsealed,vacuums,vakumlar, The most common storage device is a hard disk a set of aluminium disks coated in a magnetic material and enclosed in a vacuumsealed case used for storing the operating system and applications programs as well as the user’s data
73,commonly,common,yaygın, The main device for inputting the data is a typewriter style keyboard and the output is commonly displayed on a monitor screen that looks like a small television screen
74,software,softwar,Yazılım, The equipment is known as  the hardware and the programs and data  are the software
75,entertainment,entertain,eğlendirmek, This enables computer systems to be used for a combination of education and entertainment sometimes referred to as edutainment
76,downloading,download,indirmek, downloading music files
77,fixed,fix,düzeltmek,  Unlike most machines computers do not have a fixed purpose
78,come,come,gelmek, One of the most common peripherals is a printer used for printing the computer output the processed data or signals that come out of a computer system   on paper
79,laser,laser,lazer, CDROMs are storage devices that use laser light for reading and writing data
80,There,there,orada,  There is a range of sizes and types of computer
81,mathematical,mathemat,matemat, Common applications programs include wordprocessors for creating and editing texts spreadsheets for calculating mathematical formulae and databases for storing data ina way that allows the data to be sorted and searched
82,systems,system,sistem, Some operating systems have graphical user interfaces that allow the computer user to select items from menus lists of choices and to start programs using an input device called a mouse
83,One,one,bir, One of the most common peripherals is a printer used for printing the computer output the processed data or signals that come out of a computer system   on paper
84,uses,use,kullanmak, Computer uses mentioned in this unit include producing greetings cards learning using threedimensional graphics programs called ‘Splat the Cat’ and ‘Pets 3’ using the Microsoft Word wordprocessing program including features such as clipart readydrawn graphic images that can be inserted into documents communicating on the Internet using email and chat programs including the use of email attachments other types of files e
85,best,best,en iyi, Medical expert systems for example can help doctors diagnose an illness and decide on the best treatment
86,enclosed,enclos,muhafaza, The most common storage device is a hard disk a set of aluminium disks coated in a magnetic material and enclosed in a vacuumsealed case used for storing the operating system and applications programs as well as the user’s data
87,choices,choic,seçim, Some operating systems have graphical user interfaces that allow the computer user to select items from menus lists of choices and to start programs using an input device called a mouse
88,usually,usual,her zamanki, Those designed for use by one person at a time are known as personal computers PCs although the term PC is usually only applied to personal computers that are compatible with the standards laid down by the company known as IBM  computers include desktop computers for use on an office desk and handheld computers that can be carried around by the user
89,licences,licenc,lisans, smart cards which are able to store information such as health records drivers’ licences bank balances etc
90,desk,desk,sıra, Those designed for use by one person at a time are known as personal computers PCs although the term PC is usually only applied to personal computers that are compatible with the standards laid down by the company known as IBM  computers include desktop computers for use on an office desk and handheld computers that can be carried around by the user
91,material,materi,Teori, The most common storage device is a hard disk a set of aluminium disks coated in a magnetic material and enclosed in a vacuumsealed case used for storing the operating system and applications programs as well as the user’s data
92,applied,appli,başlıca, Those designed for use by one person at a time are known as personal computers PCs although the term PC is usually only applied to personal computers that are compatible with the standards laid down by the company known as IBM  computers include desktop computers for use on an office desk and handheld computers that can be carried around by the user
93,CDROMs,cdrom,CD-ROM, video files attached to simple email text messages distance learning and videoconferencing a form of communication over a network that uses video cameras so that the people taking part can see and hear each other electronic classrooms or boardrooms browsing the Web moving from webpage to webpage using a Web browser program selling using a website painting scanning pictures downloading music and creating CDROMs compact disk read only memory commonly referred to as CDs
94,creating,creat,yaratmak, Common applications programs include wordprocessors for creating and editing texts spreadsheets for calculating mathematical formulae and databases for storing data ina way that allows the data to be sorted and searched
95,typewriter,typewrit,daktilo, The main device for inputting the data is a typewriter style keyboard and the output is commonly displayed on a monitor screen that looks like a small television screen
96,compatible,compat,uymak, Those designed for use by one person at a time are known as personal computers PCs although the term PC is usually only applied to personal computers that are compatible with the standards laid down by the company known as IBM  computers include desktop computers for use on an office desk and handheld computers that can be carried around by the user
97,set,set,Ayarlamak,A computer is a device that processes data according to a set of instructions known  as a program
98,simply,simpli,kolay, The connection of networks throughout the world is known as the Internet note that a capital  is used or more simply the Net
99,compact,compact,kompakt, video files attached to simple email text messages distance learning and videoconferencing a form of communication over a network that uses video cameras so that the people taking part can see and hear each other electronic classrooms or boardrooms browsing the Web moving from webpage to webpage using a Web browser program selling using a website painting scanning pictures downloading music and creating CDROMs compact disk read only memory commonly referred to as CDs
100,detect,detect,tespit etmek, Antivirus programs are used to detect and remove viruses harmful programs that can reproduce themselves and attach themselves to other programs
101,sometimes,sometim,bazen, This enables computer systems to be used for a combination of education and entertainment sometimes referred to as edutainment
102,integrated,integr,bütünleşmek,        It is also possible to build all the main parts of a computer into one electronic integrated circuit packaged as a single electronic chip the common name for a microchip an electronic integrated circuit in a small package i
103,which,which,Hangi, smart cards which are able to store information such as health records drivers’ licences bank balances etc
104,contains,contain,içermek, The Web contains interlinked documents called webpages
105,monitor,monitor,izlemek, The main device for inputting the data is a typewriter style keyboard and the output is commonly displayed on a monitor screen that looks like a small television screen
106,digital,digit,hane, A digital camera allows photographs to be input to a computer for editing
107,people,peopl,halk, An Internet system designed to provide free interactive access to vast resources for people all over the world is sometimes referred to as an information superhighway
108,chip,chip,yonga,        It is also possible to build all the main parts of a computer into one electronic integrated circuit packaged as a single electronic chip the common name for a microchip an electronic integrated circuit in a small package i
109,household,household,ev, This enables computers to be built into other devices including household devices such as washing machines and fridges and to be incorporated into plastic cards i
110,searched,search,arama, Common applications programs include wordprocessors for creating and editing texts spreadsheets for calculating mathematical formulae and databases for storing data ina way that allows the data to be sorted and searched
111,search,search,arama, Websites such as Dogpile and AskJeeves give the user        access to special programs called search engines that are designed to allow the user to find relevant webpages on the Web
112,handheld,handheld,el tipi, Those designed for use by one person at a time are known as personal computers PCs although the term PC is usually only applied to personal computers that are compatible with the standards laid down by the company known as IBM  computers include desktop computers for use on an office desk and handheld computers that can be carried around by the user
113,able,abl,abart, smart cards which are able to store information such as health records drivers’ licences bank balances etc
114,simple,simpl,basitlik, video files attached to simple email text messages distance learning and videoconferencing a form of communication over a network that uses video cameras so that the people taking part can see and hear each other electronic classrooms or boardrooms browsing the Web moving from webpage to webpage using a Web browser program selling using a website painting scanning pictures downloading music and creating CDROMs compact disk read only memory commonly referred to as CDs
115,webpages,webpag,internet sayfası, The Web contains interlinked documents called webpages
116,influenced,influenc,etkilemek, How they are developed and for what purposes they are actually used in the future can be influenced by computer users
