,Code:,Raw,Root,Translation,Sentence
334,NN,build,build,inşa etmek,        It is also possible to build all the main parts of a computer into one electronic integrated circuit packaged as a single electronic chip the common name for a microchip an electronic integrated circuit in a small package i
335,NN,video,video,video, A multimedia computer can process different forms of data including text graphics audio sound animation and video
336,VB,remove,remov,kaldırmak, Antivirus programs are used to detect and remove viruses harmful programs that can reproduce themselves and attach themselves to other programs
337,NN,include,includ,Dahil etmek, Common applications programs include wordprocessors for creating and editing texts spreadsheets for calculating mathematical formulae and databases for storing data ina way that allows the data to be sorted and searched
338,VBG,selling,sell,satış, video files attached to simple email text messages distance learning and videoconferencing a form of communication over a network that uses video cameras so that the people taking part can see and hear each other electronic classrooms or boardrooms browsing the Web moving from webpage to webpage using a Web browser program selling using a website painting scanning pictures downloading music and creating CDROMs compact disk read only memory commonly referred to as CDs
339,VBG,plugging,plug,takma, Electronics can be added to desktop computers by plugging in expansion cards electronic circuit boards that can be plugged into special sockets called expansion slots
340,NN,Protocol,protocol,Protokol, An Internet service called FTP File Transfer Protocol is used for transferring data or program files between the powerful server computers that provide the network services and the client computers that use these services e
341,JJ,main,main,ana, The main device for inputting the data is a typewriter style keyboard and the output is commonly displayed on a monitor screen that looks like a small television screen
342,RB,very,veri,çok, They can be used in a very wide variety of situations and are found in a wide range of systems including security systems cars and phones
343,DT,any,ani,hiç, without any delay while the users are logged on connected to a network system account normally using a password to the system
344,NN,smart,smart,akıllı, smart cards which are able to store information such as health records drivers’ licences bank balances etc
345,NN,printing,print,baskı, One of the most common peripherals is a printer used for printing the computer output the processed data or signals that come out of a computer system   on paper
346,NN,aluminium,aluminium,alüminyum, The most common storage device is a hard disk a set of aluminium disks coated in a magnetic material and enclosed in a vacuumsealed case used for storing the operating system and applications programs as well as the user’s data
347,VBG,clicking,click,tıklama, clicking the mouse
348,NN,built,built,inşa edilmiş, This enables computers to be built into other devices including household devices such as washing machines and fridges and to be incorporated into plastic cards i
349,VBG,becoming,becom,olma, As computer systems are developed they are becoming more common and are gradually being used for more and more purposes
350,NNS,uses,use,kullanır, Computer uses mentioned in this unit include producing greetings cards learning using threedimensional graphics programs called ‘Splat the Cat’ and ‘Pets 3’ using the Microsoft Word wordprocessing program including features such as clipart readydrawn graphic images that can be inserted into documents communicating on the Internet using email and chat programs including the use of email attachments other types of files e
351,NN,client,client,müşteri, An Internet service called FTP File Transfer Protocol is used for transferring data or program files between the powerful server computers that provide the network services and the client computers that use these services e
352,NN,select,select,seçme, Some operating systems have graphical user interfaces that allow the computer user to select items from menus lists of choices and to start programs using an input device called a mouse
353,DT,all,all,tüm,        It is also possible to build all the main parts of a computer into one electronic integrated circuit packaged as a single electronic chip the common name for a microchip an electronic integrated circuit in a small package i
354,NN,hardware,hardwar,donanım, The equipment is known as  the hardware and the programs and data  are the software
355,NN,search,search,arama, Websites such as Dogpile and AskJeeves give the user        access to special programs called search engines that are designed to allow the user to find relevant webpages on the Web
356,NN,harmful,harm,zararlı, Antivirus programs are used to detect and remove viruses harmful programs that can reproduce themselves and attach themselves to other programs
357,DT,This,this,Bu, This is done by pressing a button on the mouse i
358,NNS,allows,allow,izin verir, A special set of programs called an operating system provides an interface for the user and allows applications programs to communicate with the hardware
359,NNS,licences,licenc,lisanslar, smart cards which are able to store information such as health records drivers’ licences bank balances etc
360,VBG,uploading,upload,yükleniyor, Note that copying data from a larger server system to a client is referred to as downloading and copying from the client to the server is known as uploading
361,VBN,incorporated,incorpor,Anonim, This enables computers to be built into other devices including household devices such as washing machines and fridges and to be incorporated into plastic cards i
362,JJ,available,avail,mevcut, Various communication services are available on the Internet including email electronic mail for sending and receiving text messages and IRC Internet Relay Chat which allows users to communicate using text messages in realtime i
363,IN,around,around,etrafında, Those designed for use by one person at a time are known as personal computers PCs although the term PC is usually only applied to personal computers that are compatible with the standards laid down by the company known as IBM  computers include desktop computers for use on an office desk and handheld computers that can be carried around by the user
364,NN,laser,laser,lazer, CDROMs are storage devices that use laser light for reading and writing data
365,NN,name,name,isim,        It is also possible to build all the main parts of a computer into one electronic integrated circuit packaged as a single electronic chip the common name for a microchip an electronic integrated circuit in a small package i
366,NN,user,user,kullanıcı, A special set of programs called an operating system provides an interface for the user and allows applications programs to communicate with the hardware
367,CD,One,one,Bir, One of the most common peripherals is a printer used for printing the computer output the processed data or signals that come out of a computer system   on paper
368,NN,input,input,giriş, Some operating systems have graphical user interfaces that allow the computer user to select items from menus lists of choices and to start programs using an input device called a mouse
369,RB,not,not,olumsuzluk,  Unlike most machines computers do not have a fixed purpose
370,WDT,Chat,chat,Sohbet, Various communication services are available on the Internet including email electronic mail for sending and receiving text messages and IRC Internet Relay Chat which allows users to communicate using text messages in realtime i
371,VBN,attached,attach,ekli, video files attached to simple email text messages distance learning and videoconferencing a form of communication over a network that uses video cameras so that the people taking part can see and hear each other electronic classrooms or boardrooms browsing the Web moving from webpage to webpage using a Web browser program selling using a website painting scanning pictures downloading music and creating CDROMs compact disk read only memory commonly referred to as CDs
372,NN,multipurpose,multipurpos,çok amaçlı, They are multipurpose tools
373,RB,gradually,gradual,gitgide, As computer systems are developed they are becoming more common and are gradually being used for more and more purposes
374,VBG,sending,send,gönderme, Various communication services are available on the Internet including email electronic mail for sending and receiving text messages and IRC Internet Relay Chat which allows users to communicate using text messages in realtime i
375,VBG,downloading,download,indiriliyor, downloading music files
376,NN,server,server,sunucu, An Internet service called FTP File Transfer Protocol is used for transferring data or program files between the powerful server computers that provide the network services and the client computers that use these services e
377,NN,unit,unit,birim, Computer uses mentioned in this unit include producing greetings cards learning using threedimensional graphics programs called ‘Splat the Cat’ and ‘Pets 3’ using the Microsoft Word wordprocessing program including features such as clipart readydrawn graphic images that can be inserted into documents communicating on the Internet using email and chat programs including the use of email attachments other types of files e
378,VBN,vacuumsealed,vacuums,vakum mühürlendi, The most common storage device is a hard disk a set of aluminium disks coated in a magnetic material and enclosed in a vacuumsealed case used for storing the operating system and applications programs as well as the user’s data
379,JJS,newest,newest,en yeni,  One of the newest and most popular services available on the Internet is the Worid Wide Web WWW which is often simply referred to as the Web note the use of the capital W
380,NNS,messages,messag,mesajlar, Various communication services are available on the Internet including email electronic mail for sending and receiving text messages and IRC Internet Relay Chat which allows users to communicate using text messages in realtime i
381,NN,vast,vast,büyüklük, An Internet system designed to provide free interactive access to vast resources for people all over the world is sometimes referred to as an information superhighway
382,NN,Antivirus,antivirus,antivirüs, Antivirus programs are used to detect and remove viruses harmful programs that can reproduce themselves and attach themselves to other programs
383,NNS,standards,standard,standartlar, Those designed for use by one person at a time are known as personal computers PCs although the term PC is usually only applied to personal computers that are compatible with the standards laid down by the company known as IBM  computers include desktop computers for use on an office desk and handheld computers that can be carried around by the user
384,DT,Some,some,Bazı, Some operating systems have graphical user interfaces that allow the computer user to select items from menus lists of choices and to start programs using an input device called a mouse
385,JJ,hard,hard,sert, The most common storage device is a hard disk a set of aluminium disks coated in a magnetic material and enclosed in a vacuumsealed case used for storing the operating system and applications programs as well as the user’s data
386,NNS,slots,slot,yuvalar, Electronics can be added to desktop computers by plugging in expansion cards electronic circuit boards that can be plugged into special sockets called expansion slots
387,JJ,popular,popular,popüler,  One of the newest and most popular services available on the Internet is the Worid Wide Web WWW which is often simply referred to as the Web note the use of the capital W
388,IN,that,that,o,     A computer is a device that processes data according to a set of instructions known  as a program
389,NN,hear,hear,duymak, video files attached to simple email text messages distance learning and videoconferencing a form of communication over a network that uses video cameras so that the people taking part can see and hear each other electronic classrooms or boardrooms browsing the Web moving from webpage to webpage using a Web browser program selling using a website painting scanning pictures downloading music and creating CDROMs compact disk read only memory commonly referred to as CDs
390,NN,internet,internet,internet, Networks connected together form an internet
391,NNS,webpages,webpag,internet sayfaları, The Web contains interlinked documents called webpages
392,VBG,moving,move,hareketli, video files attached to simple email text messages distance learning and videoconferencing a form of communication over a network that uses video cameras so that the people taking part can see and hear each other electronic classrooms or boardrooms browsing the Web moving from webpage to webpage using a Web browser program selling using a website painting scanning pictures downloading music and creating CDROMs compact disk read only memory commonly referred to as CDs
393,IN,Wide,wide,Geniş,  One of the newest and most popular services available on the Internet is the Worid Wide Web WWW which is often simply referred to as the Web note the use of the capital W
394,NN,term,term,terim, Those designed for use by one person at a time are known as personal computers PCs although the term PC is usually only applied to personal computers that are compatible with the standards laid down by the company known as IBM  computers include desktop computers for use on an office desk and handheld computers that can be carried around by the user
395,VBN,integrated,integr,Birleşik,        It is also possible to build all the main parts of a computer into one electronic integrated circuit packaged as a single electronic chip the common name for a microchip an electronic integrated circuit in a small package i
396,NNS,pictures,pictur,resimler, video files attached to simple email text messages distance learning and videoconferencing a form of communication over a network that uses video cameras so that the people taking part can see and hear each other electronic classrooms or boardrooms browsing the Web moving from webpage to webpage using a Web browser program selling using a website painting scanning pictures downloading music and creating CDROMs compact disk read only memory commonly referred to as CDs
397,NN,time,time,zaman, Those designed for use by one person at a time are known as personal computers PCs although the term PC is usually only applied to personal computers that are compatible with the standards laid down by the company known as IBM  computers include desktop computers for use on an office desk and handheld computers that can be carried around by the user
398,WDT,which,which,Hangi, smart cards which are able to store information such as health records drivers’ licences bank balances etc
399,VBG,pressing,press,basmak, This is done by pressing a button on the mouse i
400,JJ,single,singl,bekar,        It is also possible to build all the main parts of a computer into one electronic integrated circuit packaged as a single electronic chip the common name for a microchip an electronic integrated circuit in a small package i
401,RB,commonly,common,yaygın olarak, The main device for inputting the data is a typewriter style keyboard and the output is commonly displayed on a monitor screen that looks like a small television screen
402,NN,operating,oper,işletme, A special set of programs called an operating system provides an interface for the user and allows applications programs to communicate with the hardware
403,NNS,Electronics,electron,Elektronik, Electronics can be added to desktop computers by plugging in expansion cards electronic circuit boards that can be plugged into special sockets called expansion slots
404,NN,Transfer,transfer,Aktar, An Internet service called FTP File Transfer Protocol is used for transferring data or program files between the powerful server computers that provide the network services and the client computers that use these services e
405,NNS,ﬁles,ﬁles,dosyalar, An Internet service called FTP File Transfer Protocol is used for transferring data or program ﬁles between the powerful server computers that provide the network services and the client computers that use these services e
406,IN,without,without,olmadan, without any delay while the users are logged on connected to a network system account normally using a password to the system
407,NN,email,email,e-posta, Various communication services are available on the Internet including email electronic mail for sending and receiving text messages and IRC Internet Relay Chat which allows users to communicate using text messages in realtime i
408,VBN,known,known,bilinen,     A computer is a device that processes data according to a set of instructions known  as a program
409,NN,ina,ina,sonra, Common applications programs include wordprocessors for creating and editing texts spreadsheets for calculating mathematical formulae and databases for storing data ina way that allows the data to be sorted and searched
410,NN,IRC,irc,IRC, Various communication services are available on the Internet including email electronic mail for sending and receiving text messages and IRC Internet Relay Chat which allows users to communicate using text messages in realtime i
411,VBG,washing,wash,yıkama, This enables computers to be built into other devices including household devices such as washing machines and fridges and to be incorporated into plastic cards i
412,NN,reproduce,reproduc,çoğaltmak, Antivirus programs are used to detect and remove viruses harmful programs that can reproduce themselves and attach themselves to other programs
413,IN,for,for,için, A special set of programs called an operating system provides an interface for the user and allows applications programs to communicate with the hardware
414,NNP,Advanced,advanc,Gelişmiş, Advanced systems known as expert systems enable computers to ‘think’ like experts
415,NN,edutainment,edutain,eğitim, This enables computer systems to be used for a combination of education and entertainment sometimes referred to as edutainment
416,NN,touch,touch,dokunmak,  Services such as these allow people to telecommute use their computers to stay in touch with the office while they are working at home
417,NN,disk,disk,disk, video files attached to simple email text messages distance learning and videoconferencing a form of communication over a network that uses video cameras so that the people taking part can see and hear each other electronic classrooms or boardrooms browsing the Web moving from webpage to webpage using a Web browser program selling using a website painting scanning pictures downloading music and creating CDROMs compact disk read only memory commonly referred to as CDs
418,NN,chip’,chip,yonga', the ‘computer on a chip’
419,NNS,records,record,kayıtlar, smart cards which are able to store information such as health records drivers’ licences bank balances etc
420,NN,security,secur,güvenlik, They can be used in a very wide variety of situations and are found in a wide range of systems including security systems cars and phones
421,VBN,searched,search,arandı, Common applications programs include wordprocessors for creating and editing texts spreadsheets for calculating mathematical formulae and databases for storing data ina way that allows the data to be sorted and searched
422,JJ,interactive,interact,etkileşimli, An Internet system designed to provide free interactive access to vast resources for people all over the world is sometimes referred to as an information superhighway
