,Raw,Root,Translation,Sentence
117,these,these,bunlar, An Internet service called FTP File Transfer Protocol is used for transferring data or program files between the powerful server computers that provide the network services and the client computers that use these services e
118,audio,audio,ses, A multimedia computer can process different forms of data including text graphics audio sound animation and video
119,added,ad,reklam, Electronics can be added to desktop computers by plugging in expansion cards electronic circuit boards that can be plugged into special sockets called expansion slots
120,cameras,camera,kamera, video files attached to simple email text messages distance learning and videoconferencing a form of communication over a network that uses video cameras so that the people taking part can see and hear each other electronic classrooms or boardrooms browsing the Web moving from webpage to webpage using a Web browser program selling using a website painting scanning pictures downloading music and creating CDROMs compact disk read only memory commonly referred to as CDs
121,receiving,receiv,alıcı, Various communication services are available on the Internet including email electronic mail for sending and receiving text messages and IRC Internet Relay Chat which allows users to communicate using text messages in realtime i
122,are,are,var olan, The equipment is known as  the hardware and the programs and data  are the software
123,situations,situat,yerleştirilmiş, They can be used in a very wide variety of situations and are found in a wide range of systems including security systems cars and phones
124,world,world,dünya, The connection of networks throughout the world is known as the Internet note that a capital  is used or more simply the Net
125,This,this,Bu, This is done by pressing a button on the mouse i
126,allow,allow,izin vermek, Some operating systems have graphical user interfaces that allow the computer user to select items from menus lists of choices and to start programs using an input device called a mouse
127,person,person,kişi, Those designed for use by one person at a time are known as personal computers PCs although the term PC is usually only applied to personal computers that are compatible with the standards laid down by the company known as IBM  computers include desktop computers for use on an office desk and handheld computers that can be carried around by the user
128,realtime,realtim,gerçek zamanlı, Various communication services are available on the Internet including email electronic mail for sending and receiving text messages and IRC Internet Relay Chat which allows users to communicate using text messages in realtime i
129,features,featur,özellik, Computer uses mentioned in this unit include producing greetings cards learning using threedimensional graphics programs called ‘Splat the Cat’ and ‘Pets 3’ using the Microsoft Word wordprocessing program including features such as clipart readydrawn graphic images that can be inserted into documents communicating on the Internet using email and chat programs including the use of email attachments other types of files e
130,email,email,e -posta, Various communication services are available on the Internet including email electronic mail for sending and receiving text messages and IRC Internet Relay Chat which allows users to communicate using text messages in realtime i
131,form,form,biçim, Connecting computers together to form a network can provide the ‘connectivity’ required to enable computers and software to communicate and fo share resources
132,equipment,equip,donatmak, The equipment is known as  the hardware and the programs and data  are the software
133,data,data,veri,A computer is a device that processes data according to a set of instructions known  as a program
134,example,exampl,örnek, Medical expert systems for example can help doctors diagnose an illness and decide on the best treatment
135,enables,enabl,elden çıkarmak, This enables computers to be built into other devices including household devices such as washing machines and fridges and to be incorporated into plastic cards i
136,such,such,çok, This enables computers to be built into other devices including household devices such as washing machines and fridges and to be incorporated into plastic cards i
137,memory,memori,hafıza, video files attached to simple email text messages distance learning and videoconferencing a form of communication over a network that uses video cameras so that the people taking part can see and hear each other electronic classrooms or boardrooms browsing the Web moving from webpage to webpage using a Web browser program selling using a website painting scanning pictures downloading music and creating CDROMs compact disk read only memory commonly referred to as CDs
138,office,offic,EĞER, Those designed for use by one person at a time are known as personal computers PCs although the term PC is usually only applied to personal computers that are compatible with the standards laid down by the company known as IBM  computers include desktop computers for use on an office desk and handheld computers that can be carried around by the user
139,They,they,onlar, They are multipurpose tools
140,tools,tool,alet, They are multipurpose tools
141,Microsoft,microsoft,Microsoft, Computer uses mentioned in this unit include producing greetings cards learning using threedimensional graphics programs called ‘Splat the Cat’ and ‘Pets 3’ using the Microsoft Word wordprocessing program including features such as clipart readydrawn graphic images that can be inserted into documents communicating on the Internet using email and chat programs including the use of email attachments other types of files e
142,editing,edit,Düzenle, Common applications programs include wordprocessors for creating and editing texts spreadsheets for calculating mathematical formulae and databases for storing data ina way that allows the data to be sorted and searched
143,images,imag,ima etmek, Computer uses mentioned in this unit include producing greetings cards learning using threedimensional graphics programs called ‘Splat the Cat’ and ‘Pets 3’ using the Microsoft Word wordprocessing program including features such as clipart readydrawn graphic images that can be inserted into documents communicating on the Internet using email and chat programs including the use of email attachments other types of files e
144,storing,store,mağaza, Common applications programs include wordprocessors for creating and editing texts spreadsheets for calculating mathematical formulae and databases for storing data ina way that allows the data to be sorted and searched
145,Cat’,cat,kedi, Computer uses mentioned in this unit include producing greetings cards learning using threedimensional graphics programs called ‘Splat the Cat’ and ‘Pets 3’ using the Microsoft Word wordprocessing program including features such as clipart readydrawn graphic images that can be inserted into documents communicating on the Internet using email and chat programs including the use of email attachments other types of files e
146,personal,person,kişi, Those designed for use by one person at a time are known as personal computers PCs although the term PC is usually only applied to personal computers that are compatible with the standards laid down by the company known as IBM  computers include desktop computers for use on an office desk and handheld computers that can be carried around by the user
147,service,servic,Hizmet, An Internet service called FTP File Transfer Protocol is used for transferring data or program files between the powerful server computers that provide the network services and the client computers that use these services e
148,vast,vast,büyüklük, An Internet system designed to provide free interactive access to vast resources for people all over the world is sometimes referred to as an information superhighway
149,select,select,seçme, Some operating systems have graphical user interfaces that allow the computer user to select items from menus lists of choices and to start programs using an input device called a mouse
150,drivers’,driver,şoför, smart cards which are able to store information such as health records drivers’ licences bank balances etc
151,store,store,mağaza, smart cards which are able to store information such as health records drivers’ licences bank balances etc
152,style,style,stil, The main device for inputting the data is a typewriter style keyboard and the output is commonly displayed on a monitor screen that looks like a small television screen
153,selling,sell,satmak, video files attached to simple email text messages distance learning and videoconferencing a form of communication over a network that uses video cameras so that the people taking part can see and hear each other electronic classrooms or boardrooms browsing the Web moving from webpage to webpage using a Web browser program selling using a website painting scanning pictures downloading music and creating CDROMs compact disk read only memory commonly referred to as CDs
154,signals,signal,sinyal, One of the most common peripherals is a printer used for printing the computer output the processed data or signals that come out of a computer system   on paper
155,fridges,fridg,fridg, This enables computers to be built into other devices including household devices such as washing machines and fridges and to be incorporated into plastic cards i
156,program,program,program,A computer is a device that processes data according to a set of instructions known  as a program
157,experts,expert,uzman, Advanced systems known as expert systems enable computers to ‘think’ like experts
158,databases,databas,veri tabanı, Common applications programs include wordprocessors for creating and editing texts spreadsheets for calculating mathematical formulae and databases for storing data ina way that allows the data to be sorted and searched
159,sizes,size,boyut,  There is a range of sizes and types of computer
160,spreadsheets,spreadsheet,e -tablo, Common applications programs include wordprocessors for creating and editing texts spreadsheets for calculating mathematical formulae and databases for storing data ina way that allows the data to be sorted and searched
161,distance,distanc,Uzak durma, video files attached to simple email text messages distance learning and videoconferencing a form of communication over a network that uses video cameras so that the people taking part can see and hear each other electronic classrooms or boardrooms browsing the Web moving from webpage to webpage using a Web browser program selling using a website painting scanning pictures downloading music and creating CDROMs compact disk read only memory commonly referred to as CDs
162,boards,board,yazı tahtası, Electronics can be added to desktop computers by plugging in expansion cards electronic circuit boards that can be plugged into special sockets called expansion slots
163,access,access,erişim, Websites such as Dogpile and AskJeeves give the user        access to special programs called search engines that are designed to allow the user to find relevant webpages on the Web
164,‘think’,think,düşünmek, Advanced systems known as expert systems enable computers to ‘think’ like experts
165,etc,etc,vb, smart cards which are able to store information such as health records drivers’ licences bank balances etc
166,users,user,kullanıcı, How they are developed and for what purposes they are actually used in the future can be influenced by computer users
167,user,user,kullanıcı, A special set of programs called an operating system provides an interface for the user and allows applications programs to communicate with the hardware
168,mentioned,mention,Anma, Computer uses mentioned in this unit include producing greetings cards learning using threedimensional graphics programs called ‘Splat the Cat’ and ‘Pets 3’ using the Microsoft Word wordprocessing program including features such as clipart readydrawn graphic images that can be inserted into documents communicating on the Internet using email and chat programs including the use of email attachments other types of files e
169,webpage,webpag,internet sayfası, video files attached to simple email text messages distance learning and videoconferencing a form of communication over a network that uses video cameras so that the people taking part can see and hear each other electronic classrooms or boardrooms browsing the Web moving from webpage to webpage using a Web browser program selling using a website painting scanning pictures downloading music and creating CDROMs compact disk read only memory commonly referred to as CDs
170,according,accord,anlaşma,A computer is a device that processes data according to a set of instructions known  as a program
171,wordprocessors,wordprocessor,kelime işlemci, Common applications programs include wordprocessors for creating and editing texts spreadsheets for calculating mathematical formulae and databases for storing data ina way that allows the data to be sorted and searched
172,interlinked,interlink,birbirine karışmak, The Web contains interlinked documents called webpages
173,Word,word,kelime, Computer uses mentioned in this unit include producing greetings cards learning using threedimensional graphics programs called ‘Splat the Cat’ and ‘Pets 3’ using the Microsoft Word wordprocessing program including features such as clipart readydrawn graphic images that can be inserted into documents communicating on the Internet using email and chat programs including the use of email attachments other types of files e
174,displayed,display,Görüntüle, The main device for inputting the data is a typewriter style keyboard and the output is commonly displayed on a monitor screen that looks like a small television screen
175,taking,take,almak, video files attached to simple email text messages distance learning and videoconferencing a form of communication over a network that uses video cameras so that the people taking part can see and hear each other electronic classrooms or boardrooms browsing the Web moving from webpage to webpage using a Web browser program selling using a website painting scanning pictures downloading music and creating CDROMs compact disk read only memory commonly referred to as CDs
176,way,way,yol, Common applications programs include wordprocessors for creating and editing texts spreadsheets for calculating mathematical formulae and databases for storing data ina way that allows the data to be sorted and searched
177,Chat,chat,sohbet, Various communication services are available on the Internet including email electronic mail for sending and receiving text messages and IRC Internet Relay Chat which allows users to communicate using text messages in realtime i
178,graphic,graphic,grafik, Computer uses mentioned in this unit include producing greetings cards learning using threedimensional graphics programs called ‘Splat the Cat’ and ‘Pets 3’ using the Microsoft Word wordprocessing program including features such as clipart readydrawn graphic images that can be inserted into documents communicating on the Internet using email and chat programs including the use of email attachments other types of files e
179,required,requir,gerekmek, Connecting computers together to form a network can provide the ‘connectivity’ required to enable computers and software to communicate and fo share resources
180,aluminium,aluminium,alüminyum, The most common storage device is a hard disk a set of aluminium disks coated in a magnetic material and enclosed in a vacuumsealed case used for storing the operating system and applications programs as well as the user’s data
181,very,veri,veri, They can be used in a very wide variety of situations and are found in a wide range of systems including security systems cars and phones
182,gradually,gradual,kademeli, As computer systems are developed they are becoming more common and are gradually being used for more and more purposes
183,pictures,pictur,Pikter, video files attached to simple email text messages distance learning and videoconferencing a form of communication over a network that uses video cameras so that the people taking part can see and hear each other electronic classrooms or boardrooms browsing the Web moving from webpage to webpage using a Web browser program selling using a website painting scanning pictures downloading music and creating CDROMs compact disk read only memory commonly referred to as CDs
184,internet,internet,internet, Networks connected together form an internet
185,documents,document,belge, The Web contains interlinked documents called webpages
186,Worid,worid,ve istiyorum,  One of the newest and most popular services available on the Internet is the Worid Wide Web WWW which is often simply referred to as the Web note the use of the capital W
187,main,main,ana, The main device for inputting the data is a typewriter style keyboard and the output is commonly displayed on a monitor screen that looks like a small television screen
188,what,what,ne, How they are developed and for what purposes they are actually used in the future can be influenced by computer users
189,that,that,o,A computer is a device that processes data according to a set of instructions known  as a program
190,one,one,bir, Those designed for use by one person at a time are known as personal computers PCs although the term PC is usually only applied to personal computers that are compatible with the standards laid down by the company known as IBM  computers include desktop computers for use on an office desk and handheld computers that can be carried around by the user
191,multimedia,multimedia,multimedya, A multimedia computer can process different forms of data including text graphics audio sound animation and video
192,peripherals,peripher,Çevresel, A variety of devices known as peripherals can be added externally to a computer
193,actually,actual,gerçek, How they are developed and for what purposes they are actually used in the future can be influenced by computer users
194,more,more,daha fazla, As computer systems are developed they are becoming more common and are gradually being used for more and more purposes
195,doctors,doctor,doktor, Medical expert systems for example can help doctors diagnose an illness and decide on the best treatment
196,‘connectivity’,connect,bağlamak, Connecting computers together to form a network can provide the ‘connectivity’ required to enable computers and software to communicate and fo share resources
197,attach,attach,eklemek, Antivirus programs are used to detect and remove viruses harmful programs that can reproduce themselves and attach themselves to other programs
198,disk,disk,disk, video files attached to simple email text messages distance learning and videoconferencing a form of communication over a network that uses video cameras so that the people taking part can see and hear each other electronic classrooms or boardrooms browsing the Web moving from webpage to webpage using a Web browser program selling using a website painting scanning pictures downloading music and creating CDROMs compact disk read only memory commonly referred to as CDs
199,slots,slot,yuva, Electronics can be added to desktop computers by plugging in expansion cards electronic circuit boards that can be plugged into special sockets called expansion slots
200,website,websit,Web sitesi, A set of related webpages stored together on a server computer is called a website
201,computer,comput,hesap,A computer is a device that processes data according to a set of instructions known  as a program
202,called,call,aramak, A special set of programs called an operating system provides an interface for the user and allows applications programs to communicate with the hardware
203,Web,web,ağ,  One of the newest and most popular services available on the Internet is the Worid Wide Web WWW which is often simply referred to as the Web note the use of the capital W
204,capital,capit,yakalar, The connection of networks throughout the world is known as the Internet note that a capital  is used or more simply the Net
205,reading,read,okuman, CDROMs are storage devices that use laser light for reading and writing data
206,out,out,dışarı, One of the most common peripherals is a printer used for printing the computer output the processed data or signals that come out of a computer system   on paper
207,referred,refer,bahsetmek, Devices that include a computer circuit are commonly referred to as smart devices
208,Relay,relay,röle, Various communication services are available on the Internet including email electronic mail for sending and receiving text messages and IRC Internet Relay Chat which allows users to communicate using text messages in realtime i
209,processes,process,işlem,A computer is a device that processes data according to a set of instructions known  as a program
210,circuit,circuit,devre, Electronics can be added to desktop computers by plugging in expansion cards electronic circuit boards that can be plugged into special sockets called expansion slots
211,diagnose,diagnos,Teşhis, Medical expert systems for example can help doctors diagnose an illness and decide on the best treatment
212,information,inform,bilgi vermek, smart cards which are able to store information such as health records drivers’ licences bank balances etc
213,security,secur,menkul kıymet, They can be used in a very wide variety of situations and are found in a wide range of systems including security systems cars and phones
214,see,see,görmek, video files attached to simple email text messages distance learning and videoconferencing a form of communication over a network that uses video cameras so that the people taking part can see and hear each other electronic classrooms or boardrooms browsing the Web moving from webpage to webpage using a Web browser program selling using a website painting scanning pictures downloading music and creating CDROMs compact disk read only memory commonly referred to as CDs
215,have,have,Sahip olmak, Some operating systems have graphical user interfaces that allow the computer user to select items from menus lists of choices and to start programs using an input device called a mouse
216,common,common,yaygın,        It is also possible to build all the main parts of a computer into one electronic integrated circuit packaged as a single electronic chip the common name for a microchip an electronic integrated circuit in a small package i
217,clipart,clipart,keçe, Computer uses mentioned in this unit include producing greetings cards learning using threedimensional graphics programs called ‘Splat the Cat’ and ‘Pets 3’ using the Microsoft Word wordprocessing program including features such as clipart readydrawn graphic images that can be inserted into documents communicating on the Internet using email and chat programs including the use of email attachments other types of files e
218,lists,list,liste, Some operating systems have graphical user interfaces that allow the computer user to select items from menus lists of choices and to start programs using an input device called a mouse
219,their,their,onların,  Services such as these allow people to telecommute use their computers to stay in touch with the office while they are working at home
220,powerful,power,güç, An Internet service called FTP File Transfer Protocol is used for transferring data or program files between the powerful server computers that provide the network services and the client computers that use these services e
221,including,includ,Dahil etmek, This enables computers to be built into other devices including household devices such as washing machines and fridges and to be incorporated into plastic cards i
222,all,all,tüm,        It is also possible to build all the main parts of a computer into one electronic integrated circuit packaged as a single electronic chip the common name for a microchip an electronic integrated circuit in a small package i
223,communication,communic,İletişim, Various communication services are available on the Internet including email electronic mail for sending and receiving text messages and IRC Internet Relay Chat which allows users to communicate using text messages in realtime i
224,this,this,Bu, Computer uses mentioned in this unit include producing greetings cards learning using threedimensional graphics programs called ‘Splat the Cat’ and ‘Pets 3’ using the Microsoft Word wordprocessing program including features such as clipart readydrawn graphic images that can be inserted into documents communicating on the Internet using email and chat programs including the use of email attachments other types of files e
225,can,can,Yapabilmek, Antivirus programs are used to detect and remove viruses harmful programs that can reproduce themselves and attach themselves to other programs
226,purposes,purpos,amaç, As computer systems are developed they are becoming more common and are gradually being used for more and more purposes
227,files,file,dosya, An Internet service called FTP File Transfer Protocol is used for transferring data or program files between the powerful server computers that provide the network services and the client computers that use these services e
228,AskJeeves,askjeev,Askjeev, Websites such as Dogpile and AskJeeves give the user        access to special programs called search engines that are designed to allow the user to find relevant webpages on the Web
229,purpose,purpos,amaç,  Unlike most machines computers do not have a fixed purpose
