,Code:,Raw,Root,Translation,Sentence
218,NNS,images,imag,Görüntüler, Computer uses mentioned in this unit include producing greetings cards learning using threedimensional graphics programs called ‘Splat the Cat’ and ‘Pets 3’ using the Microsoft Word wordprocessing program including features such as clipart readydrawn graphic images that can be inserted into documents communicating on the Internet using email and chat programs including the use of email attachments other types of files e
219,RB,well,well,kuyu, The most common storage device is a hard disk a set of aluminium disks coated in a magnetic material and enclosed in a vacuumsealed case used for storing the operating system and applications programs as well as the user’s data
220,NN,illness,ill,hastalık, Medical expert systems for example can help doctors diagnose an illness and decide on the best treatment
221,NN,note,note,Not, The connection of networks throughout the world is known as the Internet note that a capital  is used or more simply the Net
222,RB,externally,extern,dışarıdan, A variety of devices known as peripherals can be added externally to a computer
223,JJ,enable,enabl,etkinleştirme, Advanced systems known as expert systems enable computers to ‘think’ like experts
224,WRB,How,how,Nasıl, How they are developed and for what purposes they are actually used in the future can be influenced by computer users
225,RB,Not,not,Değil,  Not all computer systems are compatible i
226,JJS,best,best,en iyi, Medical expert systems for example can help doctors diagnose an illness and decide on the best treatment
227,NNP,Cat’,cat,Kedi', Computer uses mentioned in this unit include producing greetings cards learning using threedimensional graphics programs called ‘Splat the Cat’ and ‘Pets 3’ using the Microsoft Word wordprocessing program including features such as clipart readydrawn graphic images that can be inserted into documents communicating on the Internet using email and chat programs including the use of email attachments other types of files e
228,NN,delay,delay,gecikme, without any delay while the users are logged on connected to a network system account normally using a password to the system
229,JJ,free,free,Bedava, An Internet system designed to provide free interactive access to vast resources for people all over the world is sometimes referred to as an information superhighway
230,RB,usually,usual,genellikle, Those designed for use by one person at a time are known as personal computers PCs although the term PC is usually only applied to personal computers that are compatible with the standards laid down by the company known as IBM  computers include desktop computers for use on an office desk and handheld computers that can be carried around by the user
231,JJ,electronic,electron,elektronik, Electronics can be added to desktop computers by plugging in expansion cards electronic circuit boards that can be plugged into special sockets called expansion slots
232,VBG,working,work,Çalışma,  Services such as these allow people to telecommute use their computers to stay in touch with the office while they are working at home
233,NNS,data,data,veri,     A computer is a device that processes data according to a set of instructions known  as a program
234,IN,with,with,ile birlikte, A special set of programs called an operating system provides an interface for the user and allows applications programs to communicate with the hardware
235,EX,There,there,Orası,  There is a range of sizes and types of computer
236,VB,find,find,bulmak, Websites such as Dogpile and AskJeeves give the user        access to special programs called search engines that are designed to allow the user to find relevant webpages on the Web
237,NN,menus,menus,menüler, Some operating systems have graphical user interfaces that allow the computer user to select items from menus lists of choices and to start programs using an input device called a mouse
238,VBN,referred,refer,sevk, Devices that include a computer circuit are commonly referred to as smart devices
239,NN,detect,detect,tespit etmek, Antivirus programs are used to detect and remove viruses harmful programs that can reproduce themselves and attach themselves to other programs
240,NN,screen,screen,ekran, The main device for inputting the data is a typewriter style keyboard and the output is commonly displayed on a monitor screen that looks like a small television screen
241,NN,multimedia,multimedia,multimedya, A multimedia computer can process different forms of data including text graphics audio sound animation and video
242,NNS,documents,document,belgeler, The Web contains interlinked documents called webpages
243,NN,WWW,www,WWW,  One of the newest and most popular services available on the Internet is the Worid Wide Web WWW which is often simply referred to as the Web note the use of the capital W
244,JJ,‘think’,think,'düşünmek', Advanced systems known as expert systems enable computers to ‘think’ like experts
245,VBG,communicating,communic,iletişim, Computer uses mentioned in this unit include producing greetings cards learning using threedimensional graphics programs called ‘Splat the Cat’ and ‘Pets 3’ using the Microsoft Word wordprocessing program including features such as clipart readydrawn graphic images that can be inserted into documents communicating on the Internet using email and chat programs including the use of email attachments other types of files e
246,NN,texts,text,metinler, Common applications programs include wordprocessors for creating and editing texts spreadsheets for calculating mathematical formulae and databases for storing data ina way that allows the data to be sorted and searched
247,VBG,Connecting,connect,Bağlanıyor, Connecting computers together to form a network can provide the ‘connectivity’ required to enable computers and software to communicate and fo share resources
248,JJ,small,small,küçük, The main device for inputting the data is a typewriter style keyboard and the output is commonly displayed on a monitor screen that looks like a small television screen
249,NN,etc,etc,vb, smart cards which are able to store information such as health records drivers’ licences bank balances etc
250,NN,future,futur,gelecek, How they are developed and for what purposes they are actually used in the future can be influenced by computer users
251,NN,form,form,biçim, Connecting computers together to form a network can provide the ‘connectivity’ required to enable computers and software to communicate and fo share resources
252,NN,superhighway,superhighway,süper otoyol, An Internet system designed to provide free interactive access to vast resources for people all over the world is sometimes referred to as an information superhighway
253,VBD,added,ad,katma, Electronics can be added to desktop computers by plugging in expansion cards electronic circuit boards that can be plugged into special sockets called expansion slots
254,NNS,fridges,fridg,buzdolapları, This enables computers to be built into other devices including household devices such as washing machines and fridges and to be incorporated into plastic cards i
255,NN,mail,mail,posta, Various communication services are available on the Internet including email electronic mail for sending and receiving text messages and IRC Internet Relay Chat which allows users to communicate using text messages in realtime i
256,DT,The,the,bu, The equipment is known as  the hardware and the programs and data  are the software
257,NN,information,inform,bilgi, smart cards which are able to store information such as health records drivers’ licences bank balances etc
258,NN,decide,decid,karar ver, Medical expert systems for example can help doctors diagnose an illness and decide on the best treatment
259,NN,communicate,communic,iletişim kurmak, A special set of programs called an operating system provides an interface for the user and allows applications programs to communicate with the hardware
260,VBG,scanning,scan,tarama, video files attached to simple email text messages distance learning and videoconferencing a form of communication over a network that uses video cameras so that the people taking part can see and hear each other electronic classrooms or boardrooms browsing the Web moving from webpage to webpage using a Web browser program selling using a website painting scanning pictures downloading music and creating CDROMs compact disk read only memory commonly referred to as CDs
261,NN,attach,attach,eklemek, Antivirus programs are used to detect and remove viruses harmful programs that can reproduce themselves and attach themselves to other programs
262,NNS,types,type,türleri,  There is a range of sizes and types of computer
263,VBN,used,use,Kullanılmış, Antivirus programs are used to detect and remove viruses harmful programs that can reproduce themselves and attach themselves to other programs
264,VBN,carried,carri,taşınan, Those designed for use by one person at a time are known as personal computers PCs although the term PC is usually only applied to personal computers that are compatible with the standards laid down by the company known as IBM  computers include desktop computers for use on an office desk and handheld computers that can be carried around by the user
265,NNS,cars,car,arabalar, They can be used in a very wide variety of situations and are found in a wide range of systems including security systems cars and phones
266,DT,each,each,her biri, video files attached to simple email text messages distance learning and videoconferencing a form of communication over a network that uses video cameras so that the people taking part can see and hear each other electronic classrooms or boardrooms browsing the Web moving from webpage to webpage using a Web browser program selling using a website painting scanning pictures downloading music and creating CDROMs compact disk read only memory commonly referred to as CDs
267,VBN,mentioned,mention,adı geçen, Computer uses mentioned in this unit include producing greetings cards learning using threedimensional graphics programs called ‘Splat the Cat’ and ‘Pets 3’ using the Microsoft Word wordprocessing program including features such as clipart readydrawn graphic images that can be inserted into documents communicating on the Internet using email and chat programs including the use of email attachments other types of files e
268,VBN,done,done,tamamlamak, This is done by pressing a button on the mouse i
269,NN,world,world,dünya, The connection of networks throughout the world is known as the Internet note that a capital  is used or more simply the Net
270,VBG,taking,take,alarak, video files attached to simple email text messages distance learning and videoconferencing a form of communication over a network that uses video cameras so that the people taking part can see and hear each other electronic classrooms or boardrooms browsing the Web moving from webpage to webpage using a Web browser program selling using a website painting scanning pictures downloading music and creating CDROMs compact disk read only memory commonly referred to as CDs
271,NN,Note,note,Not, Note that copying data from a larger server system to a client is referred to as downloading and copying from the client to the server is known as uploading
272,NNS,users,user,kullanıcılar, How they are developed and for what purposes they are actually used in the future can be influenced by computer users
273,VBN,required,requir,gereklidir, Connecting computers together to form a network can provide the ‘connectivity’ required to enable computers and software to communicate and fo share resources
274,RB,normally,normal,normalde, without any delay while the users are logged on connected to a network system account normally using a password to the system
275,NNS,Services,servic,Hizmetler,  Services such as these allow people to telecommute use their computers to stay in touch with the office while they are working at home
276,NNS,Askjeeves,askjeev,Askeeeves, Websites such as Dogpile and Askjeeves give the user  access to special programs called search engines that are designed to allow the userto ﬁnd relevant webpages on the Web
277,NN,plastic,plastic,plastik, This enables computers to be built into other devices including household devices such as washing machines and fridges and to be incorporated into plastic cards i
278,JJ,common,common,yaygın,        It is also possible to build all the main parts of a computer into one electronic integrated circuit packaged as a single electronic chip the common name for a microchip an electronic integrated circuit in a small package i
279,NN,network,network,ağ, Connecting computers together to form a network can provide the ‘connectivity’ required to enable computers and software to communicate and fo share resources
280,NN,sound,sound,ses, A multimedia computer can process different forms of data including text graphics audio sound animation and video
281,NN,home,home,ev,  Services such as these allow people to telecommute use their computers to stay in touch with the office while they are working at home
282,NN,user’s,user,kullanıcılar, The most common storage device is a hard disk a set of aluminium disks coated in a magnetic material and enclosed in a vacuumsealed case used for storing the operating system and applications programs as well as the user’s data
283,NNS,lists,list,listeler, Some operating systems have graphical user interfaces that allow the computer user to select items from menus lists of choices and to start programs using an input device called a mouse
284,NNS,looks,look,görünüyor, The main device for inputting the data is a typewriter style keyboard and the output is commonly displayed on a monitor screen that looks like a small television screen
285,NN,realtime,realtim,gerçek zamanlı, Various communication services are available on the Internet including email electronic mail for sending and receiving text messages and IRC Internet Relay Chat which allows users to communicate using text messages in realtime i
286,NN,example,exampl,örnek, Medical expert systems for example can help doctors diagnose an illness and decide on the best treatment
287,VBG,Including,includ,İçermek, Computer uses mentioned in this unit include producing greetings cards learning using threedimensional graphics programs called ‘Splat the Cat’ and ‘Pets 3 using the Microsoft Word wordprocessing program including features such as clipart readydrawn graphic images that can be inserted into documents communicating on the Internet using email and chat programs Including the use of email attachments other types of ﬁles e
288,NNS,boards,board,panolar, Electronics can be added to desktop computers by plugging in expansion cards electronic circuit boards that can be plugged into special sockets called expansion slots
289,NN,help,help,Yardım Edin, Medical expert systems for example can help doctors diagnose an illness and decide on the best treatment
290,NNS,AskJeeves,askjeev,SorJeeves, Websites such as Dogpile and AskJeeves give the user        access to special programs called search engines that are designed to allow the user to find relevant webpages on the Web
291,NN,light,light,ışık, CDROMs are storage devices that use laser light for reading and writing data
292,NNS,spreadsheets,spreadsheet,elektronik tablolar, Common applications programs include wordprocessors for creating and editing texts spreadsheets for calculating mathematical formulae and databases for storing data ina way that allows the data to be sorted and searched
293,NN,program,program,program,     A computer is a device that processes data according to a set of instructions known  as a program
294,VBN,fixed,fix,sabit,  Unlike most machines computers do not have a fixed purpose
295,PRP,They,they,Onlar, They are multipurpose tools
296,VBN,stored,store,saklanmış, A set of related webpages stored together on a server computer is called a website
297,VBN,called,call,aranan, A special set of programs called an operating system provides an interface for the user and allows applications programs to communicate with the hardware
298,VBN,designed,design,tasarlanmış, Those designed for use by one person at a time are known as personal computers PCs although the term PC is usually only applied to personal computers that are compatible with the standards laid down by the company known as IBM  computers include desktop computers for use on an office desk and handheld computers that can be carried around by the user
299,VB,come,come,gelmek, One of the most common peripherals is a printer used for printing the computer output the processed data or signals that come out of a computer system   on paper
300,NN,output,output,çıktı, The main device for inputting the data is a typewriter style keyboard and the output is commonly displayed on a monitor screen that looks like a small television screen
301,NN,chat,chat,sohbet, Computer uses mentioned in this unit include producing greetings cards learning using threedimensional graphics programs called ‘Splat the Cat’ and ‘Pets 3’ using the Microsoft Word wordprocessing program including features such as clipart readydrawn graphic images that can be inserted into documents communicating on the Internet using email and chat programs including the use of email attachments other types of files e
302,NNS,classrooms,classroom,sınıflar, video files attached to simple email text messages distance learning and videoconferencing a form of communication over a network that uses video cameras so that the people taking part can see and hear each other electronic classrooms or boardrooms browsing the Web moving from webpage to webpage using a Web browser program selling using a website painting scanning pictures downloading music and creating CDROMs compact disk read only memory commonly referred to as CDs
303,NN,computer,comput,bilgisayar,     A computer is a device that processes data according to a set of instructions known  as a program
304,JJ,able,abl,hünerli, smart cards which are able to store information such as health records drivers’ licences bank balances etc
305,NN,education,educ,Eğitim, This enables computer systems to be used for a combination of education and entertainment sometimes referred to as edutainment
306,NN,‘Splat,splat,'Uyarı, Computer uses mentioned in this unit include producing greetings cards learning using threedimensional graphics programs called ‘Splat the Cat’ and ‘Pets 3’ using the Microsoft Word wordprocessing program including features such as clipart readydrawn graphic images that can be inserted into documents communicating on the Internet using email and chat programs including the use of email attachments other types of files e
307,NNS,CDs,cds,CD'ler, video files attached to simple email text messages distance learning and videoconferencing a form of communication over a network that uses video cameras so that the people taking part can see and hear each other electronic classrooms or boardrooms browsing the Web moving from webpage to webpage using a Web browser program selling using a website painting scanning pictures downloading music and creating CDROMs compact disk read only memory commonly referred to as CDs
308,NN,webpage,webpag,internet sayfası, video files attached to simple email text messages distance learning and videoconferencing a form of communication over a network that uses video cameras so that the people taking part can see and hear each other electronic classrooms or boardrooms browsing the Web moving from webpage to webpage using a Web browser program selling using a website painting scanning pictures downloading music and creating CDROMs compact disk read only memory commonly referred to as CDs
309,NN,communication,communic,iletişim, Various communication services are available on the Internet including email electronic mail for sending and receiving text messages and IRC Internet Relay Chat which allows users to communicate using text messages in realtime i
310,NN,entertainment,entertain,eğlence, This enables computer systems to be used for a combination of education and entertainment sometimes referred to as edutainment
311,NNS,choices,choic,seçimler, Some operating systems have graphical user interfaces that allow the computer user to select items from menus lists of choices and to start programs using an input device called a mouse
312,JJ,threedimensional,threedimension,3 boyutlu, Computer uses mentioned in this unit include producing greetings cards learning using threedimensional graphics programs called ‘Splat the Cat’ and ‘Pets 3’ using the Microsoft Word wordprocessing program including features such as clipart readydrawn graphic images that can be inserted into documents communicating on the Internet using email and chat programs including the use of email attachments other types of files e
313,VBN,processed,process,işlenmiş, One of the most common peripherals is a printer used for printing the computer output the processed data or signals that come out of a computer system   on paper
314,NN,office,offic,ofis, Those designed for use by one person at a time are known as personal computers PCs although the term PC is usually only applied to personal computers that are compatible with the standards laid down by the company known as IBM  computers include desktop computers for use on an office desk and handheld computers that can be carried around by the user
315,NN,expert,expert,uzman, Advanced systems known as expert systems enable computers to ‘think’ like experts
316,MD,cannot,cannot,olumsuz,e they cannot use the same programs and data
317,IN,although,although,olmasına rağmen, Those designed for use by one person at a time are known as personal computers PCs although the term PC is usually only applied to personal computers that are compatible with the standards laid down by the company known as IBM  computers include desktop computers for use on an office desk and handheld computers that can be carried around by the user
318,VBN,influenced,influenc,etkilenmiş, How they are developed and for what purposes they are actually used in the future can be influenced by computer users
319,NNS,resources,resourc,kaynaklar, Connecting computers together to form a network can provide the ‘connectivity’ required to enable computers and software to communicate and fo share resources
320,JJ,other,other,başka, Antivirus programs are used to detect and remove viruses harmful programs that can reproduce themselves and attach themselves to other programs
321,VBN,inserted,insert,takılı, Computer uses mentioned in this unit include producing greetings cards learning using threedimensional graphics programs called ‘Splat the Cat’ and ‘Pets 3’ using the Microsoft Word wordprocessing program including features such as clipart readydrawn graphic images that can be inserted into documents communicating on the Internet using email and chat programs including the use of email attachments other types of files e
322,NNS,people,peopl,insanlar, An Internet system designed to provide free interactive access to vast resources for people all over the world is sometimes referred to as an information superhighway
323,NNS,doctors,doctor,doktorlar, Medical expert systems for example can help doctors diagnose an illness and decide on the best treatment
324,NNS,applications,applic,uygulamalar, A special set of programs called an operating system provides an interface for the user and allows applications programs to communicate with the hardware
325,NN,bank,bank,banka, smart cards which are able to store information such as health records drivers’ licences bank balances etc
326,NNS,features,featur,özellikleri, Computer uses mentioned in this unit include producing greetings cards learning using threedimensional graphics programs called ‘Splat the Cat’ and ‘Pets 3’ using the Microsoft Word wordprocessing program including features such as clipart readydrawn graphic images that can be inserted into documents communicating on the Internet using email and chat programs including the use of email attachments other types of files e
327,NN,text,text,Metin, A multimedia computer can process different forms of data including text graphics audio sound animation and video
328,NN,health,health,sağlık, smart cards which are able to store information such as health records drivers’ licences bank balances etc
329,VBN,connected,connect,bağlı, Networks connected together form an internet
330,JJ,related,relat,ilişkili, A set of related webpages stored together on a server computer is called a website
331,VBG,videoconferencing,videoconferenc,video konferans, video files attached to simple email text messages distance learning and videoconferencing a form of communication over a network that uses video cameras so that the people taking part can see and hear each other electronic classrooms or boardrooms browsing the Web moving from webpage to webpage using a Web browser program selling using a website painting scanning pictures downloading music and creating CDROMs compact disk read only memory commonly referred to as CDs
332,NN,ﬁxed,ﬁxed,sabit,  Unlike most machines computers do not have a ﬁxed purpose
333,NN,CD5,cd5,CD5, video ﬁles attached to simple email text messages distance learning and videoconferencing a form of communication over a network that uses video cameras so that the people taking part can see and hear each other electronic classrooms or boardrooms browsing the Web moving from webpage to webpage using a Web browser program selling using a website painting scanning pictures downloading music and creating CDROMS compact disk read only memory commonly referred to as CD5
