,Raw,Root,Translation,Sentence
112,note,note,Not, The connection of networks throughout the world is known as the Internet note that a capital  is used or more simply the Net
113,being,be,olmak, As computer systems are developed they are becoming more common and are gradually being used for more and more purposes
114,sending,send,gönderme, Various communication services are available on the Internet including email electronic mail for sending and receiving text messages and IRC Internet Relay Chat which allows users to communicate using text messages in realtime i
115,processed,process,işlenmiş, One of the most common peripherals is a printer used for printing the computer output the processed data or signals that come out of a computer system   on paper
116,magnetic,magnet,manyetik, The most common storage device is a hard disk a set of aluminium disks coated in a magnetic material and enclosed in a vacuumsealed case used for storing the operating system and applications programs as well as the user’s data
117,enables,enabl,etkinleştirir, This enables computers to be built into other devices including household devices such as washing machines and fridges and to be incorporated into plastic cards i
118,cards,card,kart, Electronics can be added to desktop computers by plugging in expansion cards electronic circuit boards that can be plugged into special sockets called expansion slots
119,logged,log,oturum açmış, without any delay while the users are logged on connected to a network system account normally using a password to the system
120,Connecting,connect,Bağlanıyor, Connecting computers together to form a network can provide the ‘connectivity’ required to enable computers and software to communicate and fo share resources
121,set,set,Ayarlamak,     A computer is a device that processes data according to a set of instructions known  as a program
122,laid,laid,yataklı, Those designed for use by one person at a time are known as personal computers PCs although the term PC is usually only applied to personal computers that are compatible with the standards laid down by the company known as IBM  computers include desktop computers for use on an office desk and handheld computers that can be carried around by the user
123,over,over,üzerinde, An Internet system designed to provide free interactive access to vast resources for people all over the world is sometimes referred to as an information superhighway
124,themselves,themselv,kendileri, Antivirus programs are used to detect and remove viruses harmful programs that can reproduce themselves and attach themselves to other programs
125,clicking,click,tıklama, clicking the mouse
126,storage,storag,depolamak, CDROMs are storage devices that use laser light for reading and writing data
127,formulae,formula,forma, Common applications programs include wordprocessors for creating and editing texts spreadsheets for calculating mathematical formulae and databases for storing data ina way that allows the data to be sorted and searched
128,phones,phone,telefon, They can be used in a very wide variety of situations and are found in a wide range of systems including security systems cars and phones
129,plastic,plastic,plastik, This enables computers to be built into other devices including household devices such as washing machines and fridges and to be incorporated into plastic cards i
130,electronic,electron,elektronik, Electronics can be added to desktop computers by plugging in expansion cards electronic circuit boards that can be plugged into special sockets called expansion slots
131,compatible,compat,uyumlu, Those designed for use by one person at a time are known as personal computers PCs although the term PC is usually only applied to personal computers that are compatible with the standards laid down by the company known as IBM  computers include desktop computers for use on an office desk and handheld computers that can be carried around by the user
132,creating,creat,yaratma, Common applications programs include wordprocessors for creating and editing texts spreadsheets for calculating mathematical formulae and databases for storing data ina way that allows the data to be sorted and searched
133,PCs,pcs,PC'ler, Those designed for use by one person at a time are known as personal computers PCs although the term PC is usually only applied to personal computers that are compatible with the standards laid down by the company known as IBM  computers include desktop computers for use on an office desk and handheld computers that can be carried around by the user
134,packaged,packag,paketlenmiş,        It is also possible to build all the main parts of a computer into one electronic integrated circuit packaged as a single electronic chip the common name for a microchip an electronic integrated circuit in a small package i
135,material,materi,malzeme, The most common storage device is a hard disk a set of aluminium disks coated in a magnetic material and enclosed in a vacuumsealed case used for storing the operating system and applications programs as well as the user’s data
136,‘Splat,splat,‘Splat, Computer uses mentioned in this unit include producing greetings cards learning using threedimensional graphics programs called ‘Splat the Cat’ and ‘Pets 3’ using the Microsoft Word wordprocessing program including features such as clipart readydrawn graphic images that can be inserted into documents communicating on the Internet using email and chat programs including the use of email attachments other types of files e
137,attachments,attach,ekler, Computer uses mentioned in this unit include producing greetings cards learning using threedimensional graphics programs called ‘Splat the Cat’ and ‘Pets 3’ using the Microsoft Word wordprocessing program including features such as clipart readydrawn graphic images that can be inserted into documents communicating on the Internet using email and chat programs including the use of email attachments other types of files e
138,system,system,sistem, A special set of programs called an operating system provides an interface for the user and allows applications programs to communicate with the hardware
139,software,softwar,yazılım, The equipment is known as  the hardware and the programs and data  are the software
140,documents,document,belgeler, The Web contains interlinked documents called webpages
141,experts,expert,uzmanlar, Advanced systems known as expert systems enable computers to ‘think’ like experts
142,chat,chat,sohbet, Computer uses mentioned in this unit include producing greetings cards learning using threedimensional graphics programs called ‘Splat the Cat’ and ‘Pets 3’ using the Microsoft Word wordprocessing program including features such as clipart readydrawn graphic images that can be inserted into documents communicating on the Internet using email and chat programs including the use of email attachments other types of files e
143,realtime,realtim,gerçek zamanlı, Various communication services are available on the Internet including email electronic mail for sending and receiving text messages and IRC Internet Relay Chat which allows users to communicate using text messages in realtime i
144,items,item,öğeler, Some operating systems have graphical user interfaces that allow the computer user to select items from menus lists of choices and to start programs using an input device called a mouse
145,wordprocessing,wordprocess,sözcük, Computer uses mentioned in this unit include producing greetings cards learning using threedimensional graphics programs called ‘Splat the Cat’ and ‘Pets 3’ using the Microsoft Word wordprocessing program including features such as clipart readydrawn graphic images that can be inserted into documents communicating on the Internet using email and chat programs including the use of email attachments other types of files e
146,server,server,sunucu, An Internet service called FTP File Transfer Protocol is used for transferring data or program files between the powerful server computers that provide the network services and the client computers that use these services e
147,coated,coat,kaplanmış, The most common storage device is a hard disk a set of aluminium disks coated in a magnetic material and enclosed in a vacuumsealed case used for storing the operating system and applications programs as well as the user’s data
148,‘think’,think,'düşünmek', Advanced systems known as expert systems enable computers to ‘think’ like experts
149,more,more,daha fazla, As computer systems are developed they are becoming more common and are gradually being used for more and more purposes
150,browser,browser,tarayıcı, video files attached to simple email text messages distance learning and videoconferencing a form of communication over a network that uses video cameras so that the people taking part can see and hear each other electronic classrooms or boardrooms browsing the Web moving from webpage to webpage using a Web browser program selling using a website painting scanning pictures downloading music and creating CDROMs compact disk read only memory commonly referred to as CDs
151,diagnose,diagnos,teşhis koymak, Medical expert systems for example can help doctors diagnose an illness and decide on the best treatment
152,plugging,plug,takma, Electronics can be added to desktop computers by plugging in expansion cards electronic circuit boards that can be plugged into special sockets called expansion slots
153,music,music,müzik, downloading music files
154,bank,bank,banka, smart cards which are able to store information such as health records drivers’ licences bank balances etc
155,aluminium,aluminium,alüminyum, The most common storage device is a hard disk a set of aluminium disks coated in a magnetic material and enclosed in a vacuumsealed case used for storing the operating system and applications programs as well as the user’s data
156,user’s,user,kullanıcılar, The most common storage device is a hard disk a set of aluminium disks coated in a magnetic material and enclosed in a vacuumsealed case used for storing the operating system and applications programs as well as the user’s data
157,communicate,communic,iletişim kurmak, A special set of programs called an operating system provides an interface for the user and allows applications programs to communicate with the hardware
158,compact,compact,kompakt, video files attached to simple email text messages distance learning and videoconferencing a form of communication over a network that uses video cameras so that the people taking part can see and hear each other electronic classrooms or boardrooms browsing the Web moving from webpage to webpage using a Web browser program selling using a website painting scanning pictures downloading music and creating CDROMs compact disk read only memory commonly referred to as CDs
159,find,find,bulmak, Websites such as Dogpile and AskJeeves give the user        access to special programs called search engines that are designed to allow the user to find relevant webpages on the Web
160,instructions,instruct,Talimatlar,     A computer is a device that processes data according to a set of instructions known  as a program
161,inputting,input,giriş, The main device for inputting the data is a typewriter style keyboard and the output is commonly displayed on a monitor screen that looks like a small television screen
162,looks,look,görünüyor, The main device for inputting the data is a typewriter style keyboard and the output is commonly displayed on a monitor screen that looks like a small television screen
163,graphics,graphic,grafikler, A multimedia computer can process different forms of data including text graphics audio sound animation and video
164,messages,messag,mesaj, Various communication services are available on the Internet including email electronic mail for sending and receiving text messages and IRC Internet Relay Chat which allows users to communicate using text messages in realtime i
165,Some,some,Bazı, Some operating systems have graphical user interfaces that allow the computer user to select items from menus lists of choices and to start programs using an input device called a mouse
166,This,this,Bu, This is done by pressing a button on the mouse i
167,communicating,communic,iletişim kuran, Computer uses mentioned in this unit include producing greetings cards learning using threedimensional graphics programs called ‘Splat the Cat’ and ‘Pets 3’ using the Microsoft Word wordprocessing program including features such as clipart readydrawn graphic images that can be inserted into documents communicating on the Internet using email and chat programs including the use of email attachments other types of files e
168,databases,databas,veritabanları, Common applications programs include wordprocessors for creating and editing texts spreadsheets for calculating mathematical formulae and databases for storing data ina way that allows the data to be sorted and searched
169,case,case,dava, The most common storage device is a hard disk a set of aluminium disks coated in a magnetic material and enclosed in a vacuumsealed case used for storing the operating system and applications programs as well as the user’s data
170,photographs,photograph,fotoğraflar, A digital camera allows photographs to be input to a computer for editing
171,example,exampl,örnek, Medical expert systems for example can help doctors diagnose an illness and decide on the best treatment
172,harmful,harm,zararlı, Antivirus programs are used to detect and remove viruses harmful programs that can reproduce themselves and attach themselves to other programs
173,television,televis,televizyon, The main device for inputting the data is a typewriter style keyboard and the output is commonly displayed on a monitor screen that looks like a small television screen
174,style,style,stil, The main device for inputting the data is a typewriter style keyboard and the output is commonly displayed on a monitor screen that looks like a small television screen
175,called,call,aranan, A special set of programs called an operating system provides an interface for the user and allows applications programs to communicate with the hardware
176,free,free,Bedava, An Internet system designed to provide free interactive access to vast resources for people all over the world is sometimes referred to as an information superhighway
177,for,for,için, A special set of programs called an operating system provides an interface for the user and allows applications programs to communicate with the hardware
178,sockets,socket,soket, Electronics can be added to desktop computers by plugging in expansion cards electronic circuit boards that can be plugged into special sockets called expansion slots
179,from,from,itibaren, Some operating systems have graphical user interfaces that allow the computer user to select items from menus lists of choices and to start programs using an input device called a mouse
180,Cat’,cat,Kedi', Computer uses mentioned in this unit include producing greetings cards learning using threedimensional graphics programs called ‘Splat the Cat’ and ‘Pets 3’ using the Microsoft Word wordprocessing program including features such as clipart readydrawn graphic images that can be inserted into documents communicating on the Internet using email and chat programs including the use of email attachments other types of files e
181,selling,sell,satış, video files attached to simple email text messages distance learning and videoconferencing a form of communication over a network that uses video cameras so that the people taking part can see and hear each other electronic classrooms or boardrooms browsing the Web moving from webpage to webpage using a Web browser program selling using a website painting scanning pictures downloading music and creating CDROMs compact disk read only memory commonly referred to as CDs
182,mouse,mous,fare, Some operating systems have graphical user interfaces that allow the computer user to select items from menus lists of choices and to start programs using an input device called a mouse
183,Networks,network,Ağlar, Networks connected together form an internet
184,‘computer,comput,'bilgisayar, the ‘computer on a chip’
185,each,each,her biri, video files attached to simple email text messages distance learning and videoconferencing a form of communication over a network that uses video cameras so that the people taking part can see and hear each other electronic classrooms or boardrooms browsing the Web moving from webpage to webpage using a Web browser program selling using a website painting scanning pictures downloading music and creating CDROMs compact disk read only memory commonly referred to as CDs
186,One,one,Bir, One of the most common peripherals is a printer used for printing the computer output the processed data or signals that come out of a computer system   on paper
187,IBM,ibm,IBM, Those designed for use by one person at a time are known as personal computers PCs although the term PC is usually only applied to personal computers that are compatible with the standards laid down by the company known as IBM  computers include desktop computers for use on an office desk and handheld computers that can be carried around by the user
188,vacuumsealed,vacuums,vakum mühürlendi, The most common storage device is a hard disk a set of aluminium disks coated in a magnetic material and enclosed in a vacuumsealed case used for storing the operating system and applications programs as well as the user’s data
189,select,select,seçme, Some operating systems have graphical user interfaces that allow the computer user to select items from menus lists of choices and to start programs using an input device called a mouse
190,only,onli,sadece, Those designed for use by one person at a time are known as personal computers PCs although the term PC is usually only applied to personal computers that are compatible with the standards laid down by the company known as IBM  computers include desktop computers for use on an office desk and handheld computers that can be carried around by the user
191,cars,car,arabalar, They can be used in a very wide variety of situations and are found in a wide range of systems including security systems cars and phones
192,scanning,scan,tarama, video files attached to simple email text messages distance learning and videoconferencing a form of communication over a network that uses video cameras so that the people taking part can see and hear each other electronic classrooms or boardrooms browsing the Web moving from webpage to webpage using a Web browser program selling using a website painting scanning pictures downloading music and creating CDROMs compact disk read only memory commonly referred to as CDs
193,entertainment,entertain,eğlence, This enables computer systems to be used for a combination of education and entertainment sometimes referred to as edutainment
194,simple,simpl,basit, video files attached to simple email text messages distance learning and videoconferencing a form of communication over a network that uses video cameras so that the people taking part can see and hear each other electronic classrooms or boardrooms browsing the Web moving from webpage to webpage using a Web browser program selling using a website painting scanning pictures downloading music and creating CDROMs compact disk read only memory commonly referred to as CDs
195,combination,combin,kombinasyon, This enables computer systems to be used for a combination of education and entertainment sometimes referred to as edutainment
196,painting,paint,tablo, video files attached to simple email text messages distance learning and videoconferencing a form of communication over a network that uses video cameras so that the people taking part can see and hear each other electronic classrooms or boardrooms browsing the Web moving from webpage to webpage using a Web browser program selling using a website painting scanning pictures downloading music and creating CDROMs compact disk read only memory commonly referred to as CDs
197,without,without,olmadan, without any delay while the users are logged on connected to a network system account normally using a password to the system
198,texts,text,metinler, Common applications programs include wordprocessors for creating and editing texts spreadsheets for calculating mathematical formulae and databases for storing data ina way that allows the data to be sorted and searched
199,transferring,transfer,aktarma, An Internet service called FTP File Transfer Protocol is used for transferring data or program files between the powerful server computers that provide the network services and the client computers that use these services e
200,touch,touch,dokunmak,  Services such as these allow people to telecommute use their computers to stay in touch with the office while they are working at home
201,variety,varieti,Çeşitlilik, They can be used in a very wide variety of situations and are found in a wide range of systems including security systems cars and phones
202,special,special,özel, A special set of programs called an operating system provides an interface for the user and allows applications programs to communicate with the hardware
203,any,ani,hiç, without any delay while the users are logged on connected to a network system account normally using a password to the system
204,common,common,yaygın,        It is also possible to build all the main parts of a computer into one electronic integrated circuit packaged as a single electronic chip the common name for a microchip an electronic integrated circuit in a small package i
205,household,household,ev, This enables computers to be built into other devices including household devices such as washing machines and fridges and to be incorporated into plastic cards i
206,can,can,Yapabilmek, Antivirus programs are used to detect and remove viruses harmful programs that can reproduce themselves and attach themselves to other programs
207,personal,person,kişiye özel, Those designed for use by one person at a time are known as personal computers PCs although the term PC is usually only applied to personal computers that are compatible with the standards laid down by the company known as IBM  computers include desktop computers for use on an office desk and handheld computers that can be carried around by the user
208,printer,printer,yazıcı, One of the most common peripherals is a printer used for printing the computer output the processed data or signals that come out of a computer system   on paper
209,multimedia,multimedia,multimedya, A multimedia computer can process different forms of data including text graphics audio sound animation and video
210,carried,carri,taşınan, Those designed for use by one person at a time are known as personal computers PCs although the term PC is usually only applied to personal computers that are compatible with the standards laid down by the company known as IBM  computers include desktop computers for use on an office desk and handheld computers that can be carried around by the user
211,images,imag,Görüntüler, Computer uses mentioned in this unit include producing greetings cards learning using threedimensional graphics programs called ‘Splat the Cat’ and ‘Pets 3’ using the Microsoft Word wordprocessing program including features such as clipart readydrawn graphic images that can be inserted into documents communicating on the Internet using email and chat programs including the use of email attachments other types of files e
212,able,abl,hünerli, smart cards which are able to store information such as health records drivers’ licences bank balances etc
213,detect,detect,tespit etmek, Antivirus programs are used to detect and remove viruses harmful programs that can reproduce themselves and attach themselves to other programs
214,viruses,virus,virüsler, Antivirus programs are used to detect and remove viruses harmful programs that can reproduce themselves and attach themselves to other programs
215,simply,simpli,basitçe, The connection of networks throughout the world is known as the Internet note that a capital  is used or more simply the Net
216,hear,hear,duymak, video files attached to simple email text messages distance learning and videoconferencing a form of communication over a network that uses video cameras so that the people taking part can see and hear each other electronic classrooms or boardrooms browsing the Web moving from webpage to webpage using a Web browser program selling using a website painting scanning pictures downloading music and creating CDROMs compact disk read only memory commonly referred to as CDs
217,cannot,cannot,olumsuz,e they cannot use the same programs and data
218,camera,camera,kamera, A digital camera allows photographs to be input to a computer for editing
219,balances,balanc,dengeler, smart cards which are able to store information such as health records drivers’ licences bank balances etc
220,that,that,o,     A computer is a device that processes data according to a set of instructions known  as a program
221,sizes,size,bedenler,  There is a range of sizes and types of computer
222,greetings,greet,selamlar, Computer uses mentioned in this unit include producing greetings cards learning using threedimensional graphics programs called ‘Splat the Cat’ and ‘Pets 3’ using the Microsoft Word wordprocessing program including features such as clipart readydrawn graphic images that can be inserted into documents communicating on the Internet using email and chat programs including the use of email attachments other types of files e
