,Raw,Root,Translation,Sentence
338,operating,oper,işletme, A special set of programs called an operating system provides an interface for the user and allows applications programs to communicate with the hardware
339,disks,disk,diskler, The most common storage device is a hard disk a set of aluminium disks coated in a magnetic material and enclosed in a vacuumsealed case used for storing the operating system and applications programs as well as the user’s data
340,vast,vast,büyüklük, An Internet system designed to provide free interactive access to vast resources for people all over the world is sometimes referred to as an information superhighway
341,input,input,giriş, Some operating systems have graphical user interfaces that allow the computer user to select items from menus lists of choices and to start programs using an input device called a mouse
342,purposes,purpos,amaç, As computer systems are developed they are becoming more common and are gradually being used for more and more purposes
343,chip’,chip,yonga', the ‘computer on a chip’
344,store,store,mağaza, smart cards which are able to store information such as health records drivers’ licences bank balances etc
345,they,they,onlar, As computer systems are developed they are becoming more common and are gradually being used for more and more purposes
346,provide,provid,sağlamak, Connecting computers together to form a network can provide the ‘connectivity’ required to enable computers and software to communicate and fo share resources
347,reading,read,okuma, CDROMs are storage devices that use laser light for reading and writing data
348,required,requir,gereklidir, Connecting computers together to form a network can provide the ‘connectivity’ required to enable computers and software to communicate and fo share resources
349,fridges,fridg,buzdolabı, This enables computers to be built into other devices including household devices such as washing machines and fridges and to be incorporated into plastic cards i
350,spreadsheets,spreadsheet,E -tablolar, Common applications programs include wordprocessors for creating and editing texts spreadsheets for calculating mathematical formulae and databases for storing data ina way that allows the data to be sorted and searched
351,used,use,Kullanılmış, Antivirus programs are used to detect and remove viruses harmful programs that can reproduce themselves and attach themselves to other programs
352,together,togeth,bir arada, Connecting computers together to form a network can provide the ‘connectivity’ required to enable computers and software to communicate and fo share resources
353,Worid,worid,ve istiyorum,  One of the newest and most popular services available on the Internet is the Worid Wide Web WWW which is often simply referred to as the Web note the use of the capital W
354,copying,copi,kopyalama, Note that copying data from a larger server system to a client is referred to as downloading and copying from the client to the server is known as uploading
355,home,home,ev,  Services such as these allow people to telecommute use their computers to stay in touch with the office while they are working at home
356,Those,those,Şunlar, Those designed for use by one person at a time are known as personal computers PCs although the term PC is usually only applied to personal computers that are compatible with the standards laid down by the company known as IBM  computers include desktop computers for use on an office desk and handheld computers that can be carried around by the user
357,audio,audio,ses, A multimedia computer can process different forms of data including text graphics audio sound animation and video
358,client,client,müşteri, An Internet service called FTP File Transfer Protocol is used for transferring data or program files between the powerful server computers that provide the network services and the client computers that use these services e
359,including,includ,içermek, This enables computers to be built into other devices including household devices such as washing machines and fridges and to be incorporated into plastic cards i
360,output,output,çıktı, The main device for inputting the data is a typewriter style keyboard and the output is commonly displayed on a monitor screen that looks like a small television screen
361,editing,edit,düzenleme, Common applications programs include wordprocessors for creating and editing texts spreadsheets for calculating mathematical formulae and databases for storing data ina way that allows the data to be sorted and searched
362,CDs,cds,CD'ler, video files attached to simple email text messages distance learning and videoconferencing a form of communication over a network that uses video cameras so that the people taking part can see and hear each other electronic classrooms or boardrooms browsing the Web moving from webpage to webpage using a Web browser program selling using a website painting scanning pictures downloading music and creating CDROMs compact disk read only memory commonly referred to as CDs
363,animation,anim,animasyon, A multimedia computer can process different forms of data including text graphics audio sound animation and video
364,Note,note,Not, Note that copying data from a larger server system to a client is referred to as downloading and copying from the client to the server is known as uploading
365,printing,print,baskı, One of the most common peripherals is a printer used for printing the computer output the processed data or signals that come out of a computer system   on paper
366,with,with,ile birlikte, A special set of programs called an operating system provides an interface for the user and allows applications programs to communicate with the hardware
367,edutainment,edutain,edutain, This enables computer systems to be used for a combination of education and entertainment sometimes referred to as edutainment
368,not,not,olumsuzluk,  Unlike most machines computers do not have a fixed purpose
369,threedimensional,threedimension,3 boyutlu, Computer uses mentioned in this unit include producing greetings cards learning using threedimensional graphics programs called ‘Splat the Cat’ and ‘Pets 3’ using the Microsoft Word wordprocessing program including features such as clipart readydrawn graphic images that can be inserted into documents communicating on the Internet using email and chat programs including the use of email attachments other types of files e
370,user,user,kullanıcı, A special set of programs called an operating system provides an interface for the user and allows applications programs to communicate with the hardware
371,provides,provid,sağlayan, A special set of programs called an operating system provides an interface for the user and allows applications programs to communicate with the hardware
372,website,websit,İnternet sitesi, A set of related webpages stored together on a server computer is called a website
373,which,which,Hangi, smart cards which are able to store information such as health records drivers’ licences bank balances etc
374,relevant,relev,ilgili, Websites such as Dogpile and AskJeeves give the user        access to special programs called search engines that are designed to allow the user to find relevant webpages on the Web
375,producing,produc,üreten, Computer uses mentioned in this unit include producing greetings cards learning using threedimensional graphics programs called ‘Splat the Cat’ and ‘Pets 3’ using the Microsoft Word wordprocessing program including features such as clipart readydrawn graphic images that can be inserted into documents communicating on the Internet using email and chat programs including the use of email attachments other types of files e
376,File,file,Dosya, An Internet service called FTP File Transfer Protocol is used for transferring data or program files between the powerful server computers that provide the network services and the client computers that use these services e
377,networks,network,ağlar, The connection of networks throughout the world is known as the Internet note that a capital  is used or more simply the Net
378,newest,newest,en yeni,  One of the newest and most popular services available on the Internet is the Worid Wide Web WWW which is often simply referred to as the Web note the use of the capital W
379,Computer,comput,Bilgisayar, Computer uses mentioned in this unit include producing greetings cards learning using threedimensional graphics programs called ‘Splat the Cat’ and ‘Pets 3’ using the Microsoft Word wordprocessing program including features such as clipart readydrawn graphic images that can be inserted into documents communicating on the Internet using email and chat programs including the use of email attachments other types of files e
380,name,name,isim,        It is also possible to build all the main parts of a computer into one electronic integrated circuit packaged as a single electronic chip the common name for a microchip an electronic integrated circuit in a small package i
381,tools,tool,aletler, They are multipurpose tools
382,start,start,Başlat, Some operating systems have graphical user interfaces that allow the computer user to select items from menus lists of choices and to start programs using an input device called a mouse
383,Chat,chat,Sohbet, Various communication services are available on the Internet including email electronic mail for sending and receiving text messages and IRC Internet Relay Chat which allows users to communicate using text messages in realtime i
384,Common,common,Yaygın, Common applications programs include wordprocessors for creating and editing texts spreadsheets for calculating mathematical formulae and databases for storing data ina way that allows the data to be sorted and searched
385,popular,popular,popüler,  One of the newest and most popular services available on the Internet is the Worid Wide Web WWW which is often simply referred to as the Web note the use of the capital W
386,this,this,Bu, Computer uses mentioned in this unit include producing greetings cards learning using threedimensional graphics programs called ‘Splat the Cat’ and ‘Pets 3’ using the Microsoft Word wordprocessing program including features such as clipart readydrawn graphic images that can be inserted into documents communicating on the Internet using email and chat programs including the use of email attachments other types of files e
387,treatment,treatment,tedavi, Medical expert systems for example can help doctors diagnose an illness and decide on the best treatment
388,Transfer,transfer,Aktar, An Internet service called FTP File Transfer Protocol is used for transferring data or program files between the powerful server computers that provide the network services and the client computers that use these services e
389,access,access,erişim, Websites such as Dogpile and AskJeeves give the user        access to special programs called search engines that are designed to allow the user to find relevant webpages on the Web
390,like,like,beğenmek, The main device for inputting the data is a typewriter style keyboard and the output is commonly displayed on a monitor screen that looks like a small television screen
391,package,packag,paketi,        It is also possible to build all the main parts of a computer into one electronic integrated circuit packaged as a single electronic chip the common name for a microchip an electronic integrated circuit in a small package i
392,data,data,veri,     A computer is a device that processes data according to a set of instructions known  as a program
393,between,between,arasında, An Internet service called FTP File Transfer Protocol is used for transferring data or program files between the powerful server computers that provide the network services and the client computers that use these services e
394,Devices,devic,Cihazlar, Devices that include a computer circuit are commonly referred to as smart devices
395,There,there,Orası,  There is a range of sizes and types of computer
396,etc,etc,vb, smart cards which are able to store information such as health records drivers’ licences bank balances etc
397,well,well,kuyu, The most common storage device is a hard disk a set of aluminium disks coated in a magnetic material and enclosed in a vacuumsealed case used for storing the operating system and applications programs as well as the user’s data
398,what,what,ne, How they are developed and for what purposes they are actually used in the future can be influenced by computer users
399,form,form,biçim, Connecting computers together to form a network can provide the ‘connectivity’ required to enable computers and software to communicate and fo share resources
400,all,all,tüm,        It is also possible to build all the main parts of a computer into one electronic integrated circuit packaged as a single electronic chip the common name for a microchip an electronic integrated circuit in a small package i
401,education,educ,Eğitim, This enables computer systems to be used for a combination of education and entertainment sometimes referred to as edutainment
402,situations,situat,durumlar, They can be used in a very wide variety of situations and are found in a wide range of systems including security systems cars and phones
403,different,differ,farklı, A multimedia computer can process different forms of data including text graphics audio sound animation and video
404,health,health,sağlık, smart cards which are able to store information such as health records drivers’ licences bank balances etc
405,internet,internet,internet, Networks connected together form an internet
406,IRC,irc,IRC, Various communication services are available on the Internet including email electronic mail for sending and receiving text messages and IRC Internet Relay Chat which allows users to communicate using text messages in realtime i
407,mathematical,mathemat,matematiksel, Common applications programs include wordprocessors for creating and editing texts spreadsheets for calculating mathematical formulae and databases for storing data ina way that allows the data to be sorted and searched
408,licences,licenc,lisans, smart cards which are able to store information such as health records drivers’ licences bank balances etc
409,writing,write,yazı, CDROMs are storage devices that use laser light for reading and writing data
